descripcion|direccion|fot|irregular|medidas|esquina|barrio|frentes|pileta|urb_cerrada|posesion|urb_semicerrada|preventa|indiviso|a_demoler|es_multioferta
"VENTA TERRENO CARLOS PAZ SOBRE RUTA 38 1489 METROS. REMAX ofrece a la venta terreno ubicado sobre Bv. Sarmiento al 2500 de 1489 metros.
Caracteristicas: 1489 metros con leve pendiente positiva generando gran vista a  la ciudad y el lago. 32 metros de frente. Servicios de agua y luz. Ideal para complejos de cabañas o comerciales al estar sobre ruta. Zona de muchos comercios como karting, museo de tractores entre otros. Cuenta con escritura. LLAMANOS NO TE PIERDAS ESTA OPORTUNIDAD !!"|RUTA 38 1489|||||||||||||[]|
"VENTA LOTE BARRIO BELVEDERE CAPITAN BERMUDEZ. VENTA LOTE BARRIO ABIERTO BELVEDERE. LOTE DE 250M2, 10 METROS DE FRENTE POR 25 METROS FONDO. UBICADO EN EL BARRIO BELVEDERE(CAPITÁN BERMUDEZ), EN AVENIDA ÁNGEL MARINO GERVASO 550(ACESSO DESDE AUTOPISTA) MANZANA ""J"" LOTE ""94"".
CUENTA CON BOULEVARD CENTRAL ADOQUINADO. TODAS SUS CALLES CON CORDON CUNETA. ACESSO PRINCIPAL PAVIMENTADO.
SERVICIOS: RED LUZ ELECTRICA. ALUMBRADO PUBLICO. RED DE GAS NATURAL. RED DE AGUA POTABLE. LISTO PARA ESCRITURAR"|LOTE BARRIO BELVEDERE|||10 x 25||BARRIO BELVEDERE CAPITAN BERMUDEZ||||||||[]|
" VENTA EXCELENTE LOTE EN CAMPOS DE LA ENRIQUETA. Hermoso lote de 700 m2 con salida náutica. Disponibilidad de playa y muelle , para uso de embarcaciones sin motor. Número de Lote 288. Excelente orientación
El Emprendimiento se ubica en plena zona de desarrollo de Clubes de Campo del corredor ruta 2, La Plata - Brandsen, en el kilómetro 65 de dicha vía.
Lotes de 700 m2. y de 1000 m2. Lotes con acceso directo a espectaculares canales de agua, en los cuales podes tener un muelle y una playa privada de arena, desde donde podes salir a navegar en embarcaciones sin motor, o pescar desde tu propio jardín.
MAS DE 12 CANALES NAVEGABLES Y 2 LAGUNAS PRINCIPALES que tendrán un tratamiento especial para la mantención del agua, las especies de peces y toda su vegetación, y con un Arroyo Natural con una RESERVA DE FLORA Y FAUNA AUTOCTONA, un espacio único en la zona con juncales y espadañares, y una gran cantidad de aves, zorros, carpinchos, nutrias y liebres.
Arroyo natural y 2 lagunas artificiales navegables. Locales comerciales, club house, gimnasio spa y piscinas. Club de playa y pesca deportiva. Spa, Gimnasio y Piscina climatizada."|Lote 288.|||||club house||True||||||[]|True
"Equipo RE/MAX Cordillera Vende RE/MAX vende lote soleado y vegetación nativa en Villa Lago Meliquina.
Terreno muy soleado, con vegetación nativa con hermosas vistas en todas las direcciones.   Ubicado en Meliquina II,  cuenta con un fácil acceso desde la ruta 63 tomando la calle 22 . Posee vistas hacía el Cerro Ventana y el Cerro Muela y vistas panorámicas a las montañas.
Ubicación: Manzana Y lote 9. Metros cuadrados: 990,63 m2. Acceso: frente a la Ruta 63 a 3 km del Lago (frente a cervecería artesanal de Meliquina) por calle 22
Servicios: Loteo sin servicios de red. Uso de energías renovables y agua tomada de arroyos o vertientes. (sistemas alternativos propios de uso individual)
VALOR PUBLICADO DE CONTADO U$D 19.000 (sin posibilidad de negociación)
IMPORTANTE FINANCIACION con ESCRITURA Hipotecaria:
50% al momento de la escritura U$D 10.200 + 6 cuotas bimestrales fijas de U$D 1800en dólares. ( valor final U$D 21.000 )
OPORTUNIDAD: posibilidad de comprar el lote lindante de 962,26 m2; del mismo propietario, y poder hacer un uso turístico para cabañas, hosterías o varias construcciones en los ambos lotes."|Manzana Y lote 9|||||||||||||[]|True
"OPORTUNIDAD ULTIMOS LOTES EN BARRIO ABIERTO GARIN LOTES 12X25 PREVENTA A 12 MESES SE ENTREGAN CON TENDIDO ELECTRICO APROBADO POR EDENOR. CALLES ASFALTADAS. PILAR DE LUZ ANTICIPO 5.000 USD Y 60 CTAS FIJAS TAMBIEN PODES ENTREGAR UN ANTICIPO DE 1.800.000 PESOS Y EL RESTO EN 60 CTAS VARIABLE AL UVA. PARA MAS INFORMACION COMUNICATE CON DANIELA REINOSO VENDEDORA POBLAR DESARROLLOS. Servicios: Gas, Pavimento. Características: Medianera, Alambrado perimetral. Nos encontramos con un Barrio semi cerrado de 6 hectáreas, con lotes de 350m2 en adelante, a metros de la ruta 25 que comunica escobar con pilar, todos lotes son escriturables y sin expensas. San Juan Bautista se caracteriza por su tranquilidad y su entorno privilegiado, con mucha naturaleza en los alrededores y con una vegetación única. Precios de pre-venta y únicamente para las primeras 40 unidades. Te invitamos a que conozcas el predio y puedas formar parte de nuestra cartera de clientes, ya que nos están conociendo y eligiendo."""||||||BARRIO ABIERTO GARIN|||||True|True||[]|True
Pre-venta en pozo, 2 ambientes 41 m2 totales con balcón. Se trata de un monoambiente dividido con paneles móviles que otorgan la capacidad de dividir el ambiente generando un dormitorio cerrado sin que el departamento pierda el ingreso de luz natural ni el acceso al balcón. Posee 36,30 m2 cubiertos de 4,65 m2 de balcón.||||||||||||True||[]|
Lote de 1020 m2 con orientación NE (luz solar todo el día) La nueva etapa es una combinación ideal para acceder a una inmejorable calidad de vida, disfrutando de los espacios y dimensiones propios de la vida de campo y el confort de una ciudad. Es el sector ideal para aquellos que quieran disfrutar de los deportes acuáticos, cuenta con una laguna artificial de 5.5 hectáreas. Sus chacras, que van de 800 m2 a 1400m2 y 50 metros de frente, ofrecen una amplia distancia entre vecinos y un espacio propio suficientemente generoso. Cuentan tambiÃ©n con la posibilidad de acceso a todo tipo de actividad deportiva del mega emprendimiento. Un sector que contará con 412 lotes de 800m2 a 1400m2. Éxito total en su primer lanzamiento de pre-venta a fines del año 2017. House nÃ¡utico con muelle hacia la laguna Lotes con frente a la laguna Acceso a todo tipo de actividad deportiva dentro del mega emprendimiento (futbol, golf, polideportivo, tenis, pileta semi-olímpica).||||||||True||||True||[]|True
"Oportunidad de inversión a valores de pre-venta: Barrio abierto ""Los Aromos"", sin expensas, en la mejor zona de 20 de Junio, Matanza El proyecto contempla para la venta 80 Lotes de 900 y 1000m2 que se entregarán ESCRITURADOS en una fecha estimada cercana a DICIEMBRE 2023, y que gracias a una impecable gestión, hoy ya cuenta con Planos Aprobados en el Municipio de Matanza, y ARBA, en la La Plata. Para tal logro, serán necesarias todas las obras de infraestructura viales tales como: -Apertura de cinco calles nuevas -Aporte de suelo cemento -Aporte de tosca compactada -Aporte de cascote fino como terminaciÃ³n final -CordÃ³n cuneta de HormigÃ³n Armado en todas las nuevas calles a ceder con acceso vehicular y desagÃ¼e pluvial. El proyecto urbano tambiÃ©n contempla un plan hidrÃ¡ulico de evacuaciÃ³n de las aguas de lluvia mediante sumideros, zanjas y entubados perimetrales aprobados por el municipio de La Matanza Por otro lado, se contempla toda la iluminaciÃ³n pÃºblica y tendido elÃ©ctrico; mejorado de calles aledaÃ±as y desmalezado. El emprendimiento contará con un sector de 10.000mÂ² para el esparcimiento público."||||||||||||True||[]|True
"En la calle Bereterbide al 1200, nos encontramos con la oportunidad de adquirir ""en modalidad pre-venta"" un excelente departamento actualmente en construcción, como parte del Proyecto de Complejo "" Altos de Bereterbide"", el cual cuenta con departamentos en Primer piso y PB. El plazo estimado de entrega es de 6 a 8 meses, a contar desde Octubre 2022. Esta unidad funcional de 42,5m2 desarrollada por completo en primer piso, consta de comedor con cocina integrada, un baÃ±o completo y una habitaciÃ³n. Tiene todos los servicios y cuenta con cochera. El pago puede hacerse con una entrega inicial y financiación del saldo de precio hasta en 12 cuotas, para que te mudes al lugar de tu sueÃ±os!!!! No dudes en consultar estamos para ayudarte a encontrar tu Mejor Lugar…"|calle Bereterbide al 1200|||||||||||True||[]|
Inmejorable oportunidad de inversión a valores de pre-venta: Se trata de un barrio abierto, sin expensas, en la mejor zona de Villa la Paz, Pontevedra, Merlo, Sobre Avenida UniÃ³n, arteria principal de Pontevedra, que conecta directo con la Autopista del Buen Ayre y distintos partidos del conurbano: ItuzaingÃ³, Merlo, La Matanza, Ezeiza, CaÃ±uelas, entre otros. El proyecto contempla para la venta Lotes de 660 a 2500mÂ² que se entregarán ESCRITURADOS en una fecha estimada cercana a DICIEMBRE 2023, y que gracias a una impecable gestiÃ³n, contarán con Planos registrados en el Municipio de Merlo , y ARBA, en la La Plata. Nuestros proyectos cuentan con todas las obras de infraestructura vial necesarias para las aprobaciones||||||||||||True||[]|
Exclusiva pre-venta con financiación, anticipo y 30 cuotas!! Espectacular casa premium fondo al lago â€“ Marinas â€“ Puertos del lago. Casa de categorÃa, con sÃ³lida construcciÃ³n de HormigÃ³n H-21- Platea y dos Losas macizas â€“ CaracterÃsticas sustentables y detalles exclusivos en todos los ambientes. Lote: 888 m2 Cubiertos: 324 m2 Semicubiertos: 109 m2 Terrazas: 65 m2 Total: 498 m2||||||||||||True||[]|
LOTEO ABIERTO RECIDENCIAL COMERCIAL LISANDRO DE LA TORRE * Precio contado U$D 23.000- * Financiación con anticipo de U$D 12.000- * 48 cuotas de U$D 350- El loteo abierto Lisandro De La Torre combina la naturaleza y la cercanÃa a todo. Ya que tiene la gran virtud de estar ubicado en un pintoresco entorno y a la vez estas muy cerca de los servicios necesarios ; Shopping, supermercados, restaurantes, transportes, colegios, paradas de colectivo, etc. Se encuentra en Tortuguitas, a 5 cuadras de Ruta Nacional 8 y a 5 minutos de estaciÃ³n Del Viso y Tortuguitas, a 15 minutos de Shopping TOM. La etapa de comienzo de obra es una oportunidad ideal para poder comprar tu lote a valores y condiciones de financiación preferenciales. La primera etapa de pre-venta de Lisandro De La Torre cuenta con terrenos baldÃos a la venta de 192 metros cuadrados a 384 metros cuadrados, a subdividirse bajo el régimen de Propiedad Horizontal. * Loteo Abierto * Perfil comercial * Sin Expensas * Lotes de 8.50 por 24 Mts * Principales accesos * Electricidad * Pavimento * Financiación!!|Ruta Nacional 8|||8.50 x 24||||||||True||[]|
"BARRIO ABIERTO EN VEINTE DE JUNIO. Ubicado entre Aroma, Ceretti, Ricco y Gorostiaga Oportunidad de inversión a valores de pre-venta: Barrio abierto ""Los Aromos"", sin expensas, en la mejor zona de 20 de Junio, Matanza El proyecto contempla para la venta 80 Lotes de 900 y 1000m2 que se entregarán ESCRITURADOS en una fecha estimada cercana a DICIEMBRE 2022, y que gracias a una impecable gestiÃ³n, hoy ya cuenta con Planos Aprobados en el Municipio de Matanza, y ARBA, en la La Plata. Para tal logro, serÃ¡n necesarias todas las obras de infraestructura viales tales como: -Apertura de cinco calles nuevas -Aporte de suelo cemento -Aporte de tosca compactada -Aporte de cascote fino como terminaciÃ³n final -CordÃ³n cuneta de HormigÃ³n Armado en todas las nuevas calles a ceder con acceso vehicular y desagÃ¼e pluvial. El proyecto urbano tambiÃ©n contempla un plan hidrÃ¡ulico de evacuaciÃ³n de las aguas de lluvia mediante sumideros, zanjas y entubados perimetrales aprobados por el municipio de La Matanza Por otro lado, se contempla toda la iluminaciÃ³n pÃºblica y tendido elÃ©ctrico; mejorado de calles aledaÃ±as y desmalezado. El emprendimiento contará con un sector de 10.000mÂ² para el esparcimiento publico."||||||BARRIO ABIERTO EN VEINTE DE JUNIO||||||True||[]|True
OPORTUNIDAD SOLO MES DE JUNIO 2022 San Sebastián, ubicado en el límite de Escobar y Pilar, es el barrio indicado para vos, que buscas siempre lo mejor para tu familia. Con un acceso en el km 54,5 de la autopista panamericana, cuenta con todos los servicios necesarios para que vivas la naturaleza de una forma diferente. 13 barrios comunicados por un boulevard, lagunas, cancha de golf y más de 100 hectáreas destinadas a los deportes conforman este maravilloso ecosistema, ideal para disfrutar todos los días junto con tus seres más queridos. 154 hectáreas de lagunas Cancha de golf Canchas de futbol y tenis Seguridad 24hs Club house Disponibles Lotes internos frente a Plaza 659 Mt. La mejor orientación del Barrio Nuestra Señora del Carmen. Área 13 Anticipo USD 14.200 Restan 19 cuotas de $ 87.239,00 + CAC y 3 refuerzos de $ 375.800,00 No paga expensas hasta la posesión enero 2024. Aclaramos que tenemos varios disponibles todos con buena orientación !!! No dejes de contactarnos para mayor información Remax Duo||||||Barrio Nuestra Señora del Carmen|||True|||True||[]|
"LOTE EN VENTA * De 1187 m2 ubicado en Barrio Laguna (da a la laguna). Villa de Campo Tres Pino, partido de General Rodríguez * Entrega y posesión año 2024, Aun no se abonan expensas. * Predio de 500 hectáreas, con 7 barrios interconectados: ""Estribo"", ""Norte"", ""Polo"", ""Golf"", ""Casco"", ""Laguna"" e ""Isla"" * Club house ya funciona, se puede ir a pasar al día."||||||Barrio Laguna||||||||[]|
Lote 5 es una CESIÓN, por lo tanto paga sellos el COMPRADOR Se trata de una parcela de 795m² que forma parte del barrio privado Finca Pueyrredón en un exclusivo predio de 1.260m² con barranca al río y enmarcado en un maravilloso parque de especies añosas. FOT 0.90, FOS 0.45, Alt máx. 8,50m Retiro de frente: 5m Retiros laterales: 3m Forma de pago: 40% en USD a la adhesión 57% en cuotas 3% posesión Inmobiliaria NARVAEZ Av. Del Libertador 15.878, San Isidro, Buenos Aires, Argentina + 54 9 ******** / + 54 9 ******** ******** CSI 4169 CUCICBA 6062|Av. Del Libertador 15.878|0.90||||Finca Pueyrredón|||True|True||True||[]|
UBICADO EN BARRIO FÉLIX U. CAMET, SOBRE CALLE DIAGONAL MAR AUSTRAL ENTRE CALLE CERRO ACONQUIJA (EX 29) Y CERRO FIAMBALÁ (EX 31). CUENTA CON SERVICIOS DE LUZ; GAS; RED CLOACAL Y RECOLECCIÓN DE RESIDUOS. SECTOR EN EXPANSIÓN. ACEPTA PERMUTA POR VEHICULO EN MUY BUEN ESTADO. ESCUCHA PROPUESTAS CON UN PORCENTAJE DE FINANCIACIÓN||||||BARRIO FÉLIX U. CAMET||||||||[]|
DUEÑO DIRECTO. atencion: No respondo a Inmobiliarias. aviso: otros truchos copian y roban datos para publicar el mismo lote. tener cuidado!!! TOBAS entre COLIQUEO y ANCATRUZ. 400mts del río. zona no inundable. apto financiacion privada con garantia prop o prendaria 50% y saldo 12 cuotas en dolares sin interes- a 1500mts de ruta 11 tendido electrico en la entrada al lote no hay red de agua potable ni cloacal internet por antena parabolica .asp?id=7188&t=Punta-del-Indio-paraiso-oculto como llegar: desde capital tomar autopista buenos aires- la plata y en la primera bifurcación a la derecha pasa primer peaje. Tomar salida a la derecha a Mar del Plata ruta 2 Hudson para luego ver cartel ruta 36 EL PATO y salir en la bifurcacion a la derecha para tomar la 36 ruta hacia dolores chascomús salida empalme ruta 36 partido de la costa y en cartel a la izquierda hacer como una media U pasando por abajo del puente y todo derecho por la 36 es doble mano sin luz unos 15 minutos aprox. Pasar la primer rotonda y pasar la segunda rotonda y tercer rotonda a Pipinas qué son unos 45 minutos Aproximadamente en la cuarta rotonda seguir derecho hasta la cruz de Jesús ahí a la izquierda hay un cartel a Verónica la ruta se llama circunvalacion2. Hacer unos 7 km de ripio y después de un cartel de bienvenida a Punta Indio doblar a la derecha y seguir como 3 km más y luego doblar a la izquierda por ruta 11 en el cartel Parque Costero Sur, es como volviendo para atras. Luego doblar en calle ANCATRUZ a la derecha y seguir hasta Tobas y a 50mts está la entrada a lote 19. No esta demarcado ni amojonado ni cercado. para ir en micro: hay que llegar hasta veronica desde la plata con micro que sale de terminal. Y una vez en Veronica tomar el micro Parque Costero del Sur a Punta Indio. horarios-micro-comunal|TOBAS entre COLIQUEO y ANCATRUZ|||||||||||||[]|
Consulte por anticipo y cuotas! Parte indivisa de 5x20. Destinado a construcción de duplex. Toda la documentacion al día. Listo para escriturar. Subdivisión por PH. El de al lado esta vendido. Plano del proyecto a construir: Planta baja: Cocina comedor y toilet. Planta alta: dos dormitorios y baño completo. La mejor manera de invertir. No te pierdas esta oportunidad!|||||||||||||True|[]|
Importantes lotes de 1250m2 promedio en Fincas de Lima. Lotes perimetrales. ¡Con Posesión Inmediata! ¡Planes de financiación! FINCAS DE LIMA es un desarrollo de 17has con solo 100 lotes de 1250m2 promedio. Ubicado en Lima, partido de ZÃ¡rate, se encuentra a unos 100kms de CABA, a poco mÃ¡s de una hora en auto con acceso directo por autopista. Se accede desde la Ruta NÂ°9 por el Camino Km103. Con un entorno arbolado y en contacto con la naturaleza, es un espacio ideal para familias en busca de una mejor calidad de vida. El barrio semi-cerrado posee sólo dos accesos con tranqueras, uno desde la ruta (por Camino KM103) y el segundo desde el pueblo de Lima, otorgando seguridad y privacidad a las familias. Cuentan con servicio elÃ©ctrico con tendido aÃ©reo; calles internas mejoradas, cerco perimetral. El valor corresponde al pago de contado para los lotes: 62; 86; 88 y 91 Las dimensiones de algunos lotes varían entre 1233m2 y 1250m2 Las medidas, porcentuales, y superficies son aproximadas. Las medidas definitivas surgen del tÃtulo de propiedad, plano municipal y/o plano de mensura. Con 1.251 m2 su fondo de 28 metros se ubica sobre el hoyo 1 de la colorada, en el Barrio Pebble Beach de Pilar Golf. ¡Apto para construir inmediatamente! El precio publicado es por pago al contado. Ofrecemos financiación: USD 68.000 como anticipo y 24 cuotas de USD 6.000.- Te invitamos a recorrer el el lugar y estamos a tu disposición para todo lo que quieras saber.|desde la Ruta NÂ°9|||||Barrio Pebble Beach de Pilar Golf|||True||True|True||[]|True
Hermosa casa 3 amb a estrenar ubicada en Solis 364, Temperley Excelente ubicación a tan solo 5 cuadras de la estación de Temperley. Sup. cubierta 47m2 Sup. total 52m2 -Casa al frente totalmente refaccionada a nuevo -Living -Comedor amplio que cuenta con estufa -Cocina con muebles bajo mesada -Dos dormitorios -Baño completo -Patio A 5 cuadras de la estación de Temperley! Se puede financiar el 50% Valor con finaciacion: US$93.000 Apto crédicto *SE ESCUCHAN PROPUESTAS* *SE ACEPTAN VEHICULOS COMO PARTE DE PAGO* *SE ACEPTAN PERMUTADAS EN ZONA SUR*||||||||||||||[]|
Excelente lote en esquina, en barrio de casas nuevas - a 400 mts de camino centenario- sobre asfalto - Lote de 423 m cuadrdos. real oportunidad -posibilidad de finaciacion|||||True|||||||||[]|
Excelente casa a estrenar al agua! Barrio Cerrado Ceibos de Puertos del Lago. Excelente calidad constructiva. Posibilidad de financiación a cargo de la constructora con el 70% de anticipo y 30% hasta 24 cuotas fijas en dólares Sobre lote interno central, se desarrolla en dos plantas. En planta baja, living comedor principal con salida al exterior. Cocina con barra. Comedor diario. Toilete. Dependencia de servicio con baño completo. Lavadero independiente. Entrada lateral de servicio. En planta alta, dos dormitorios en semisuite. Suite junior. Master suite con vestidor. En el exterior galerÃa con parrilla. Piscina de 37m2.||||||Barrio Cerrado Ceibos de Puertos del Lago||True|True|||||[]|
Oportunidad! Anticipo con entrega de USD30.000 con entrega de posesion + 60 cuotas de USD500. Casa en venta en Barrio Abierto Los Campos de Fresnos, ubicado en Zarate sobre calle España, cercano a Antartida Argentina y a Ruta Nacional 9. Unidad Funcional de tres ambientes: Dos dormitorios, cocina-comedor integrada, baño completo. Parque y cochera semicubierta para dos vehiculos. Lote de 450 mts.2. Construccion en Seco. Sin Expensas. Termotanque eléctrico, cocina a gas envasado, biodigestor. InformaciÃ³n adicional: Agua caliente: Termotanque Superficie del terreno: 450|Ruta Nacional 9|||||Barrio Abierto Los Campos de Fresnos||||||True||[]|
Corredor Responsable: LAURA PALINI CSM 2733 / CPI 7752 - Contacto: Magdalena Camerlinckx - MLS ID # -4 Este departamento se encuentra en el Complejo Cerrado Cefiro, con Sum equipado con parrilla, cocina, baÃ±o y mobiliario. AdemÃ¡s cuenta con cochera. A unas cuadras de paradas de distintas lÃneas de colectivo, a unas cuadras de Ruta 8 estaciÃ³n Campo de Mayo y cerca de locales comerciales. Entrando por la puerta principal al departamento nos encontramos con un living comedor con una puerta ventana a un lindÃsimo balcÃ³n, con cocina integrada con bajo mesada y alacenas, y tambiÃ©n cuenta con conexiÃ³n para lavarropas. . Tiene una escalera que nos lleva a un altillo donde nos encontramos con un dormitorio. DespuÃ©s de la cocina tenemos tenemos un pasillo con un baÃ±o completo con baÃ±era, y despuÃ©s llegamos al dormitorio principal muy luminoso que ademÃ¡s cuenta con placard. Este departamento es un opciÃ³n para aquellas personas que buscan un lugar tranquilo donde vivir. ¿QUÉ ESTÁS ESPERANDO PARA MUDARTE? LLAMAME Y VAMOS A CONOCERLA!!! FINANCIA HASTA EL 30% Comprá la casa que querías! No la que podés. Accedé a un préstamo por hasta el 30% del valor de esta propiedad. Simula tu cuota en la página de Lendar (lendar. com. ar) SI TENES QUE VENDER PARA COMPRAR PODEMOS AYUDARTE Y REALIZAR LA OPERACIÃ“N SIMULTÃNEA. BENEFICIO PARA CLIENTES REMAX: Si comprás tu casa con RE/MAX y te falta hasta un 30% del valor podés acceder a un préstamo a través de LENDAR con mínimos requisitos y aprobaciÃ³n en sÃ³lo 7 dÃas hÃ¡biles! El trÃ¡mite es 100% online y sin bancos! Podes hacer la simulación de las cuotas y calcular vos tu préstamo. ConocÃ© mÃ¡s sobre LENDAR en su pÃ¡página www. lendar. com. ar ALCANZÃ LO QUE SOÑAS !!!! MUDATE A LA VIDA QUE QUERES||||||||||||||[]|
venta departamento en ph.-en complejo calle santa fe 735,bella vista.-pdo de san miguel esta unidad se encuentra en contrafrente Unidad desarrollada en una planta techo loza,preparado para construccion en futuro en. compuesta por cocina comedor con mobiliario.- dormitorio sin placard baÃ±o con tres sanitarios cochera descubierta total superficie 52,87m SERVICIOS_GAS ENVASADO.-LUZ.-AYSA 300.-MUNICIPAL 450-SE DIVIDE PROPORCIONAL DE GASTO DE LUZ DE BOMBA DE AGUA.- valor de venta u$s 70.000- apto credito bancario.- puede financiar: 70% al boleto con posesión y saldo 30% en cuotas a convenir.-||||||||||True||||[]|
DUEÑO DIRECTO. atencion: No respondo a Inmobiliarias. aviso: otros truchos copian y roban datos para publicar el mismo lote. tener cuidado!!! TOBAS entre COLIQUEO y ANCATRUZ. 400mts del río. zona no inundable. apto financiacion privada con garantia prop o prendaria 50% y saldo 12 cuotas en dolares sin interes- a 1500mts de ruta 11 tendido electrico en la entrada al lote no hay red de agua potable ni cloacal internet por antena parabolica .asp?id=7188&t=Punta-del-Indio-paraiso-oculto como llegar: desde capital tomar autopista buenos aires- la plata y en la primera bifurcación a la derecha pasa primer peaje. Tomar salida a la derecha a Mar del Plata ruta 2 Hudson para luego ver cartel ruta 36 EL PATO y salir en la bifurcacion a la derecha para tomar la 36 ruta hacia dolores chascomús salida empalme ruta 36 partido de la costa y en cartel a la izquierda hacer como una media U pasando por abajo del puente y todo derecho por la 36 es doble mano sin luz unos 15 minutos aprox. Pasar la primer rotonda y pasar la segunda rotonda y tercer rotonda a Pipinas qué son unos 45 minutos Aproximadamente en la cuarta rotonda seguir derecho hasta la cruz de Jesús ahí a la izquierda hay un cartel a Verónica la ruta se llama circunvalacion2. Hacer unos 7 km de ripio y después de un cartel de bienvenida a Punta Indio doblar a la derecha y seguir como 3 km más y luego doblar a la izquierda por ruta 11 en el cartel Parque Costero Sur, es como volviendo para atras. Luego doblar en calle ANCATRUZ a la derecha y seguir hasta Tobas y a 50mts está la entrada a lote 19. No esta demarcado ni amojonado ni cercado. para ir en micro: hay que llegar hasta veronica desde la plata con micro que sale de terminal. Y una vez en Veronica tomar el micro Parque Costero del Sur a Punta Indio. horarios-micro-comunal|TOBAS entre COLIQUEO y ANCATRUZ|||||||||||||[]|
