descripcion|direccion|fot|irregular|medidas|esquina|barrio|frentes|pileta|urb_cerrada|posesion|urb_semicerrada|preventa|indiviso|a_demoler|es_multioferta
Se ubica sobre Vieytes y Champagnat. Chacras de Canning. Superficie 38.500 m2 (110 x 350 metros) Superficie edificada aprox 180 m2 + Depósito VENTA: U$S 90 x m2 1 hectarea 10.000 m2 x U$S 90 = U$S 900.000 3.85 hectareas = U$S 3.465.000 VENTA: U$S 3.465.000||||110 x 350||||||||||[]|
Venta lote en excelente ubicación, con construcción prácticamente para demoler. Soler al 700 Bahía Blanca. Ideal Desarrolladores. 8.66 mts de frente, 23 mts lado oeste, 19.60 mts lado este. Zonificación C2. FOT 2.4||2.4||||||||||||[]|
Casa ideal inversores en construcción!!! Inmejorable casa en la calle Sgto. Cabral al 560, Lagos de Canning con $ de expensas (aprox). En su totalidad mide 670 m2, de los cuales 290 m2 son cubiertos y 380 m2 descubiertos. Características: altura 6 metros sin columnas. Portón: 4.80 mts. alto y 4.50 mts. ancho. Lote: 10 x 30. Cubiertos: 190 m2. Fuerza motriz. FOS 0.60. FOT 1.20.||1.20||10 x 30||||||||||[]|
Sobre Ruta 58 km 16 en Barrio San Lucas. En venta esté hermoso lote de 1112 m2 de los más grandes del barrio. Medidas exactas: Frente 43 mts. Lado izquierdo 40 mts. Lado derecho 49 mts y fondo de 15 mts.|Ruta 58 km 16|||||Barrio San Lucas||||||||[]|
Pueyrredon 86 bis. Casa 4 dormitorios, 2 baños, patio con parrillero y cochera. Superficie del terreno de 145 m2 (irregular) con Frente de 7.5 metros, contra frente de 9.8 metros, y fondo de 19.17 metros. Planos de mensura desactualizados.|Pueyrredon 86 bis||True|||||||||||[]|
1.200 m2 Panamericana Km 42, mano a Capital. Localidad de Del Viso, Partido de Pilar. Provincia de Buenos Aires. 1.200 m2. lote 70 m de frente. Forma triangular. En esquina|lote 70||True||True|||||||||[]|
Lote en esquina entre las calles Moreno y Avellaneda. Superficie terreno 210 metros. Zonificacion Rma1. FOT 1.5. FOS 0.6. Posee una construccion de un antiguo local de 220 mts||1.5|||True|||||||||[]|
Casa de 4 ambientes en Lomas del Mirador. Ubicada en Melo 836, Lomas del Mirador. Lote de 8.66 x 23. Vivienda con 100 años de antigüedad aprox. (ideal modernizar o demoler) de 90 m2 Cubiertos. Cocina. Comedor. Baño. Dormitorios. Patio. Terraza. Galpón. ZONIFICACION Zona: U2B. FOS 0.6. FOT 2.25. Densidad 700. Altura Máxima 13 mts||2.25||8.66 x 23||||||||||[]|
Ecopueblo Alvear. Único lote disponible con salida a dos calles. Manzana 18 Lote 506. Lote irregular de 315.40 m2. Cuenta con un frente al norte de 10 mts, 34.76 mts en su lado este, 11.89 en su lado sur, y 28.32 en su lado oeste.|Manzana 18 Lote 506||True|||||||||||[]|
Barrio Cerrado El Paso Del Viso, Lote A22. Lote interno, 744 m2. Cercano a área deportiva y entrada del barrio. El precio publicado incluye un 35% de descuento por ser valor de preventa|Lote A22.|||||Barrio Cerrado El Paso Del Viso|||True|||True||[]|
Terreno a la venta (Lote 8 Manzana n°1), dimensiones irregulares con frente a tres calles principales, y vistas al parque verde central del predio. Son 850 m2 de superficie total. El loteo cuenta con frente y acceso directo sobre Ruta n° 1, y bajada también directa al canal por donde se accede al río|Lote 8 Manzana n°1||True|||||||||||[]|
El lote 24 tiene 1.036 m2, con un frente de 23 metros en un área central del Barrio Pebble Beach de Pilar Golf. ¡Apto para construir inmediatamente! El precio publicado es para pago al contado. Ofrecemos finaciación: USD 49.000 como anticipo y 24 cuotas de USD 4.300. Te invitamos a recorrer el lugar y estamos a tu disposición para todo lo que quieras saber.|lote 24 tiene|||||Barrio Pebble Beach de Pilar Golf||||||||[]|
Lote en Los Pasos 2 barrios del Jockey. Lote 05 en manzana E de 800 m2, ubicado en esquina, 20 x 40 mts. Los Pasos, Barrios cerrados del Jockey cuentan con accesos rápidos. Los mismos se encuentran ubicados en Fisherton dentro de la ciudad de Rosario y con acceso mediante puentes al Jockey Club. Ubicación preferencial cerca de la Autopista Rosario-Córdoba, Calle Mendoza y Calle Urquiza. Cercano al del aeropuerto, al centro comercial de Fisherton Mall y a Funes.|Lote 05 en manzana E|||20 x 40|True|||||||||[]|
Te presentamos un hermoso chalet de 3 ambientes con gran parque, ubicado en La Primavera entre Zeballos y Godoy Cruz, en el barrio Las Dalias, próximo a Parque Camet. Esta propiedad posee un amplio y muy cómodo living con hogar y entrepiso con playroom con vista hacia el living. La cocina comedor se encuentra mediante barra desayunadora, cuenta con doble ventana que le otorga mucha luminosidad, mesada en L y espacio para lavarropas. Los dos dormitorios tienen amplios placares con bauleras. El baño es completo, con ducha y revestimientos cerámicos. Además, cuenta con un gran parque en el cual dispone de un quincho semicubierto, pileta y entrada pasante para autos. El chalet posee todos los servicios y se encuentra en buen estado general. Tiene paredón perimetral. El lote tiene 15 metros de frente por 26 metros de fondo, con una superficie total de 390 m2.|Primavera entre Zeballos y Godoy Cruz|||15 x 26||barrio Las Dalias||True||||||[]|
Venta Lote IDEAL PROYECTO EDILICIO sobre José Indart entre Ocampo y Perón. Frente 10 Fondo 31. FOT 3. Actualmente posee dos casas construidas en muy buen estado con cochera pasante. Todas las medidas son aproximadas y provistas por el cliente. Información Adicional: gas natural. Servicios: cloacas, gas|José Indart entre Ocampo y Perón|3||10 x 31||||||||||[]|
Casa en venta en la zona sur de la ciudad. Ubicación: Jose Maria Eguiluz n° 663. Barrio San Fernando. La casa se posee un terreno amplio de 413 m2, y tiene acceso por 2 calles, por adelante con calle Jose Maria Eguiluz y por atras con calle Jose Amenabar. Ideal proyecto e inversión|Jose Maria Eguiluz n° 663|||||Barrio San Fernando||||||||[]|
CASA 4 AMB SUITE. PILETA + DEPTO 3 AMB BELGRANO R. Amplio living comedor con salida al patio. Patio con parrilla, piscina y lavadero. Cocina. Toilette de recepción. Cochera para un auto. Hall de distribución. Amplio dormitorio con baño en suite y vista al patio. Dos dormitorios con placard y acceso a balcón al frente. Baño completo. Antiguedad: aprox 50 años. Cochera para 1 auto. Termotanque. Horno y anafe a gas. Instalación para aire acondicionado. Calefacción por estufas de tiro balanceado. Pisos, baños e instalación eléctrica reciclados hace 7 años. Parrilla. Piscina. SUPERFICIE. Cubierta: 301 m2. Frente: 8.66 m. Fondo: 43.30 m. Sup. Terreno: 374.97 m2. GASTOS: ABL: $15.248. UBICACION: Holmberg al 1600 entre Virrey del Pino y Carbajal. En el barrio de Villa Ortúzar, con proximidad a numerosos comercios y cercanía a Av. de los Incas y Av. álvarez Thomas||||||||True||||||[]|
Diagonal 80 esquina 115. Lote a la venta sobre una de las arterias principales de la ciudad de La Plata. El mismo posee una superficie total de 722 m2 y se encuentra ubicado sobre una esquina.|Diagonal 80 esquina 115||||True|||||||||[]|
Lote con salida a dos calles, ubicado en la calle Tejedor entre Av. José María Moreno y calle Beauchef con 17 metros de frente. Se encuentra a cuatro cuadras de Av. Pedro Goyena; dos de la Av. Directorio. Subte E y varias lineas de colectivos. Acceso a autopista. Superficie total: 1700 m2. Superficie construible: 5720 aproximadamente.|calle Tejedor entre Av. José María Moreno y calle Beauchef|||||||||||||[]|
ATENCIÓN CONSTRUCTORAS: Excelente lote de 8.66 de Frente x 35 de largo, ideal inversión para construcción de departamentos en torre, emprendimiento o vivienda, en zona centrica En inmejorable ubicación sobre la calle Sitio de Montevideo entre Salta y Oncativo. posee un FOS de 0.6 y un FOT de 3. CONSULTE OPCIONES. SE ESCUCHAN OFERTAS. SE TOMA PROPIEDAD TERMINADA POR MENOR VALOR.|calle Sitio de Montevideo entre Salta y Oncativo|3||||||||||||[]|
Lote en venta sobre la calle Rocal al 1600 entre Mons Blois y Fraga, que mide 12.90 mts de frente por 48 mts de fondo. En el mismo se encuentra construida una casa a refaccionar de 100 m2 cub aprox, de construcción solida con techo de losa. Zonificación Rmi (FOS 0.6 FOT 0.8). Posibilidad de construir PB + Primer Nivel. Ideal emprendimiento.|calle Rocal al 1600 entre Mons Blois y Fraga|0.8||12.90 x 48||||||||||[]|
Sobre la calle Lope de Vega al 2600 frente al Club de Golf San Martín y a cinco cuadras de Gral Paz, encontramos este lote irregular de 10 metros al frente y 11.91 al fondo y de 48 metros en uno de sus lados en tanto que el restante asciende a 53 metros. Buena ubicación y excelentes medidas.|calle Lope de Vega al 2600||True|10 x 11.91||||||||||[]|
Lote ubicado en barrio Parque Bristol en calle Las Heras esquina Falucho. Las medidas del mismo son de 20 x 11. Se encuentra a unas 12 cuadras del mar. FOS 0.60. FOT 0.60. UNIFAMILIAR. Expensas: 0|calle Las Heras esquina Falucho|0.60||20 x 11|True|barrio Parque Bristol||||||||[]|
Lote con una superficie total de 248 mts. MEDIDAS: 8.67 mts de frente 8.66 mts al contrafrente 28.50 mts al nord oeste 27.97 mts al nord este. Zonificacion R3. FOT 1.2. UBCACION: La propiedad se encuentra ubicada sobre la calle Islas Malvinas n° 1061 entre Urquiza y Azcuénaga, a 1 cuadra de Carlos Pellegrini, 3 cuadras de Andrés Baranda y solo 10 cuadras de la estación de tren de Quilmes.|calle Islas Malvinas n° 1061 entre Urquiza y Azcuénaga|1.2||||||||||||[]|
Ubicados sobre la Calle De Luca entre calle Alsina y Av. San Martín (arteria principal de acceso). A sólo 350 metros de la Ruta Provincial N° 6. Localidad de Los Cardales, Partido de Exaltación de la Cruz, Provincia de Buenos Aires. Características: Se trata de dos terrenos ubicados en el casco urbano de Los Cardales. Se encuentran dentro de la Zona Residencial Comercial de Densidad Media Baja (RCmb) acorde al Código de Planeamiento de Exaltación de la Cruz en la cuál se admite la edificación de departamentos y locales comerciales. Con indicadores de ocupación de: FOS: O.6 y FOT: 1.|Calle De Luca entre calle Alsina y Av. San Martín|1||||||||||||[]|
Terreno ubicado sobre calle Buenos Aires entre la calles Cerrito e Ituzaingó. Terreno irregular: Frente: 10.38 (contra frente 5.71) Fondo: 19.93. Según análisis normativa: posibilidad de PB +10|calle Buenos Aires entre la calles Cerrito e Ituzaingó||True|||||||||||[]|
Terreno en el barrio Altos del Mar en San Clemente del Tuyú. En calle 8 esquina calle 104 con frente al Barrio Playa Grande. Lote a 400 mts de la playa. Medidas 20 x 20 mts. El terreno tiene pilar de la luz. Tiene escritura, por lo que se escritura inmediatamente a su nombre. Lo reserva con 750 dólares, al firmar el boleto abona 4.500 dólares y al firmar la escritura abona 10.500 dólares.|calle 8 esquina calle 104|||20 x 20|True|barrio Altos del Mar en San Clemente del Tuyú||||||||[]|
Calle 78 entre 28 y 29. Lote en venta Características: lote de 10 x 30 mts. Valor: U$S 15.000|Calle 78 entre 28 y 29|||10 x 30||||||||||[]|
Semipiso de 1 dormitorio la estrenar en calle 7 e/ 71 y 72. Disponible en piso 5° al frente y 6° al contrafrente. Excelente iluminación y ventilación cruzada. ALQUILADO DESDE MARZO 2023 A $70.000 un dormitorio con placar living con balcón cocina con mueble bajo mesada baño completo lavadero separado cochera optativa. Listo para escriturar.|calle 7 e/ 71 y 72|||||||||||||[]|
Terreno en venta ubicada sobre calle 618 e/ 6 bis y 7. Localidad Villa Elvira al frente con orientación al Noroeste. Sobre calle de asfalto y servicios de electricidad, agua corriente, gas natural y cloacas. Regular, entre medianeras, alambrado, nivelado y con unas medidas de 10 x 35.41 mts. 354 mts2 totales. Tiene pileta de fibra|calle 618 e/ 6 bis y 7|||10 x 35.41||||True||||||[]|
Terreno en venta ubicado sobre calle 49 y 25 (Villa Elisa, La Plata, Buenos Aires). Con disposición frente y orientación este. De medidas regulares y en condición de esquina, cuenta con 13 mts de frente por 33 mts, contabilizando una superficie total de 438 mts2. Dispone de una gran forestación. Acceso por calle de ripio y con los servicios de electricidad y agua corriente disponibles en el lugar.|calle 49 y 25||||True|||||||||[]|
Terreno en venta ubicado sobre calle 487 entre 133 y 134 (Joaquín Gorina, La Plata, Buenos Aires). Con disposición frente y orientación norte. De medidas regulares, cuenta con una superficie total aproximada de 319 m2. Acceso por calle de tierra mejorada con los servicios de electricidad, agua, gas natural y cable disponibles en la zona.|calle 487 entre 133 y 134|||||||||||||[]|
Casa sobre calle 40 e/ 22 y 23 de La Plata. Lote irregular: Frente: 9 mts. Lateral Der.: 36.85 mts. Lateral Izq.: 27.85 mts. Contra-Frente: 12.72|calle 40 e/ 22 y 23||True|||||||||||[]|
Importante chalet en Barrio Parque Calchaqui. Calle 341 (Craviotto) entre 382 y 383. 6 ambientes, 4 dormitorios, 5 baños, 2 pisos, lote de 15 X 50, total 750 m2, cubierta 410 m2. Recepción, toilette, amplio living con aberturas hacia el parque, comedor principal, cocina amueblada + comedor diario, dormitorio con placard, baño completo con ante baño, dormitorio principal con pisos tarugados en suite, con baño completo, amplisimo verde, pileta, parrilla.||||15 x 50||Barrio Parque Calchaqui||True||||||[]|
Cuatro Parcelas en conjunto. 30 de frente x 100 fondo con frente calle 25 de Mayo y San Martín (dos frentes) entre Burmeister y Mosconi. sobre asfalto. con todos los servicios.||||30 x 100||||||||||[]|
Ubicación: Calle 2 bis N° 1427 entre 517 y 518, Ringuelet, La Plata. Medidas del lote: 10 metros de frente por 27.5 metros de fondo. Comodidades: 2 dormitorio, cocina, living comedor, baño, garage, entrada para auto, patio, lavadero, fondo libre.|Calle 2 bis N° 1427 entre 517 y 518|||10 x 27.5||||||||||[]|
Importante lote ubicado en excelente esquina de La Plata, con un superficie total de 1975 m2, con medidas de 32.91 m2 sobre calle 19 y 60.00 sobre calle 36. Zonificación UC/3, con un FOT de 5135 m2. El lote posee un total de 450 m2 edificados.|calle 19 y 60.00|FOT de 5135. FOT de 5135 m2|||True|||||||||[]|
Terreno regular entre medianeras en venta ubicado en calle 13 C e/ 471 y 472. Localidad City Bell con acceso por calle asfaltada. Servicios de electricidad, gas natural y agua corriente. El terreno cuenta con una construcción que posee tres dormitorios con piso flotante y placares empotrados, baño completo, cocina separada con muebles sobre y bajo mesada, living comedor con hogar a leña, lavadero cubierto, cochera cubierta para un auto y descubierta para otro, jardín parquizado con pileta y parrilla. Terreno de 10 x 40 mts. 400 mts 2 totales. 130 mts 2 cubiertos. Apto crédito bancario. Zona : U/R4. Cascos Urbanos del Eje Noroeste (Ex UR 5). Corresponde a sectores urbanos consolidados. Se promueve su ocupacion con la asignacion de valores mayores de densidad respecto a otras zonas del eje Noroeste. FOS 0.5. Altura referencia en niveles: 3. FOT comercial 0.8. FOT residencial 0.8. Densidad comercial 200, Densidad residencial 200|calle 13 C e/ 471 y 472|FOT residencial 0.8. FOT comercial 0.8||10 x 40||||True||||||[]|
Excelente lote de 586 m2, sobre calle 117 entre 526 y 527. Ideal Inversores constructores, muy baja incidencia. Ancho 10 metros x 60 en su parte mas larga y 55.50 en la parte mas corta. FOS 0.6 FOT 0.8. Densidad x Ha 300. Zona UR2. Permitido 10 UF. Escritura inmediata. Proyecto de 10 UF+cocheras|calle 117 entre 526 y 527|0.8||10 x 60||||||||||[]|
Excelente propiedad sobre esquina con un frente lineal de 162 metros y salida a tres calles, Cabildo, Guatemala y Pilcomayo. Superficie de terreno 6200 m2. Contrapiso para camiones en casi su totalidad. Sectores descubiertos a reciclar. Zona industrial. Apto todo destino. FOT residencial: 2, FOT industrial: 1.5, FOS: 60% max.||FOT industrial: 1.5. FOT residencial: 2|||True|||||||||[]|
Avenida Montevideo y 105. Lote de 8.66 x 26 mts. Ideal emprendimiento. Zona S2 R3 con cloacas. FOS 0.6 y FOT 1.8 Densidad 800 habitantes.|Avenida Montevideo y 105|1.8||8.66 x 26||||||||||[]|
Venta de lote en Flores, Capital Federal. GRAN PROYECTO INMOBILIARIO POSIBLE. Frente 8.66 x fondo 38.1 m2 en Flores CABA. USAA (C3II). Sobre Avenida Directorio esquina Avenida San Pedrito. Gran flujo vehicular y peatonal|Avenida Directorio esquina Avenida San Pedrito|||8.66 x 38.1|True|||||||||[]|
Lote c/ mejoras. Superficie irregular. Medidas: 9.69 mts de frente, 8.66 mts de fondo, 22.59 y 18.17 laterales. Orientación: Este Oeste. Excelente zona comercial. Sobre Avenida Alte. Brown entre calles Indalecio Gomez y Conscripto Bernardi. OPORTUNIDAD !!  |Brown entre calles Indalecio Gomez y Conscripto Bernardi||True|||||||||||[]|
Venta de Lote, Villa Gesell. Avenida 2 e/ Paseo 118 y 119. Lote multifamiliar. Ideal Inversores. Lote Multifamiliar de alta densidad a 2 cuadras de la playa. Excelente ubicación. Superficies: Sup. Lote: 1304.74 m2 (20.00m de frente). Zonificación: RMA. FOS 0.60. FOT 2. DENSIDAD 800 HAB/HA. C.U.V. 0.025. POTENCIAL CONSTRUCTIVO HASTA 32 UNIDADES DE VIVIENDA. Puede construirse un máximo de 2607.48 m2 distribuidos en 6 Pisos.|Avenida 2 e/ Paseo 118 y 119|2||||||||||||[]|
Lote en Av. Santa Fe al 300, en la mejor zona de Alberdi apto construcción de edificio. Posibilidad de desarrollo planta baja + siete pisos, 38 unidades de vivienda y 2 locales comerciales. Metros terreno 360 m2 (9x41.25). Zona B. Edificable: 2.440 m2 aproximadamente. A demoler.|Av. Santa Fe al 300|||||||||||||[]|
Excelente terreno de 8.66 mts de frente por 43.50 mts de fondo, sobre Av. Manuel Belgrano al 6200. Ideal inversor. El FOT es de 2.5.|Av. Manuel Belgrano al 6200|2.5||8.66 x 43.50||||||||||[]|
Venta de Lote en Mataderos, Capital Federal. Lote de 8.66 x 32 USAA (22.80) 7 + 2 retiro. Superficie de la parcela 287.07 m2. Zonificación anterior R2B1. Fot: 1.6. Por normas vigentes USAA Mixtura 3. Sup. cubierta total vendible 1142.47 m2. Sup. balcon/terraza vendible 265.68 m2. Sup. total construible 1731.91 m2 + 10 espacios guarda coche en PB. Excelente ubicación sobre Av. Lisandro de La Torre 1400 entre Alberdi y E. Castro.|Av. Lisandro de La Torre 1400 entre Alberdi y E. Castro|1.6||8.66 x 32||||||||||[]|
Hermoso lote de 1098 m2, ubicado en una excelente zona del Barrio Las Lomas de San Isidro. Av. Fleming 2800. Próximo al hipodromo de San Isidro. FOS 0.4: 439.2 m2. FOT 0.8: 878.4 m2. Uso exclusivo vivienda Unifamiliar!|Av. Fleming 2800|0.8||||Barrio Las Lomas de San Isidro||||||||[]|
Av. Caseros esq. Lomas de Zamora, Don Bosco. Barrio Nuevo Quilmes. Bienvenido a esta impresionante casa de 7 ambientes, una joya ubicada en el codiciado Barrio Nuevo Quilmes. Este oasis se ubica en una esquina, sobre un lote espacioso de 788 m2, con amplio espacio de estacionamiento. La misma consta de dos plantas sobre un lote de 788 m2 con espacio guardacoche para varios autos. Construida sobre platea con losa estructural. Doble muro. La casa esta compuesta por un hall de recepción, amplio living-comedor con hogar a leña y vista al parque, cocina con isla central, cinco dormitorios (el principal con vestidor, baño en suite con jacuzzi y terraza), toilette, lavadero con entrada independiente, 5 baños (2 completos), amplio quincho con parrilla, cuarto de guardado, hall de entrada en el primer piso y kitchenette. Cuenta con jardín con piscina climatizada con playa húmeda e hidromasaje. Además, la casa cuenta con un sexto dormitorio de servicio con un baño completo.|Av. Caseros esq. Lomas de Zamora||||True|||True||||||[]|
Imponente lote de 1038 m2 en esquina sobre la Av Gral. Guemes esquina Gral. Arredondo frente al Shopping Alto Avellaneda con 29 mts de frente sobre la Avenida Guemes x 29 mts sobre Arredondo. Son 4 lotes. Ubicado a 3 cuadras del CBC UBA (Sede Avellaneda). Ideal emprendimiento multifamiliar con zocalo comercial y cocheras. Parcela 01: 244.1 m2. Parcela 02: 226.0 m2. Parcela 24: 320.0 m2. Parcela 25: 248.6 m2. EDIFICABILIDAD: Fos máx.: 60% FOT residencial: 2.5 FOT comercial: 3|Av Gral. Guemes esquina Gral. Arredondo frente al Shopping Alto Avellaneda|FOT residencial: 2.5. FOT comercial: 3|||True|||||||||[]|True
Alberti 3359, Mar del Plata. Edificio en construcción: DEPARTAMENTOS DE CATEGORÍA. Venta en pozo: ANTICIPO Y FINANCIACIÓN. Entrega aproximada Julio 2025. 8 pisos de departamentos y quincho común en el piso 9. Unidades de 2 ambientes de 47 mts2 de 52 mts2. Unidades de 3 ambientes de 92 m2 (semipisos). Amplios balcones con parrilla. Terraza con pileta compartida.||||||||True||||True||[]|
Lote de terreno irregular en excelente ubicación. 2° Rivadavia esquina Navarro. Castelar Norte. Medidas: lote irregular: 18 x 24. Superficie total: 353.89 m2. Valor: U$s 150.000.|||True|18 x 24|True|||||||||[]|
Lote de 8.66 x 22.30. En excelente ubicación, a seis cuadras de avenida Santa Fe y a dos cuadras de calle Paraná. Sobre el terreno hay una edificación de tres ambientes para demoler. Apta vivienda unifamiliar. Zonificación RMB2, FOS 0.5, FOT 1, RADIO 7.||1||8.66 x 22.30||||||||||[]|
Venta de Lote en Barrio Hipódromo, La Plata. Lote sobre Avenida 38 de 328 m2 superficie, el mismo posee zonificación U/C3 (AREA URBANA/ Áreas de promoción y Corredores de Acceso Principal y Complementaria) apto para desarrollo constructivos o comerciales ya que se permiten construir hasta 6 Niveles (Fos 0.6/ Fot Res. 2; Fot Com. 2.4. Den Res. 800; Den Com. 1.600/ Premios 30% en FOT y DEN.), el mismo cuenta con una casa de 3 dormitorios, cocina comedor, baño y garage, la misma se encuentra a reciclar o demoler. Morfología irregular, medidas 7.54 x 39.82 x 9.43 mts.||FOT residencial: 2. FOT comercial: 2.4|True|7.54 x 39.82 x 9.43||Barrio Hipódromo||||||||[]|
Galpón en esquina, con muy buen acceso a Panamericana y Ruta 202 (a solo 600 metros). Zonificación: área industrial I2. Características:. Altura 6 metros sin columnas. Portón: 4.80 mts. alto y 4.50 mts. ancho. Lote: 10 x 30. Cubiertos: 190 m2. Fuerza motriz. FOS 0.60. FOT 1.20.||1.20||10 x 30|True|||||||||[]|
Lote de 10 x 30 en Lomas del Mirador. Excelente acceso a una cuadra de Gral Paz y 3 de Mosconi y de Tonelero. FOT 2.25. FOS 0.6.||2.25||10 x 30||||||||||[]|
Terreno en venta. Lote irregular de 131 m2. Con frente de 8.76, un lateral de 16.8 y otro lateral de 13.6. FOT 2.5||2.5|True|||||||||||[]|
Sólido PH en Barrio Grand Bell. Al frente, 3 ambientes con patio y jardín de 7 x 5. Son solo 2 unidades en el lote. Techo de losa con posibilidad de ampliación. Los dos dormitorios al frente. Living-comedor con cocina integrada. Baño completo. Lavadero. Patio y jardín con pequeña pileta de fibra de vidrio. La propiedad está de época. Antigüedad 40 años. Muy buena ubicación y buenos accesos.||||7 x 5||Barrio Grand Bell||True||||||[]|
Lote en venta de (1.500 m2) con excelente ubicación! El cual consta de: Dos frentes a calles, uno con vista al Norte y otro al Este. Dos niveles de superficie, uno con tierra y otro nivel más elevado sobre roca.Amplias vistas panorámicas hacia las sierras chicas, sierras grandes y centro de Tanti. Colindante con espacio verde sobre lado Sur y parte del Oeste. Excepcional base para diseño de parque en rocalla. Existencia de acacias, paraísos, durazneros, yucas, lantanas, aromitos, palo amarillo y romerillos.Pasan por el frente TV por cable y recolección de residuos; luz instalada hasta unos 40 mts, y agua a 100 mts.||||||||||||||[]|
Ubicado en una esquina muy importante de Villa Ballester. Con acceso a varias líneas de colectivos. Frente 22 m, lateral 19.33 m y superficie de 422 m2. Cantidad de pisos a construir PB más 3 pisos. Estudio de factibilidad disponible. fot 3 + 30% en premios. Se escuchan ofertas. Se vende ya!||FOT 3 + 30% en premios. FOT 3|||True|||||||||[]|
Sobre lote de 20 x 100. Amplio parque al frente, pileta de 4 x 8 y taller. Casa principal Living comedor, cocina, 1 dormitorio amplio con baño, sector lavadero y otra habitación. Tiene otra casa que requiere puesta a punto pero de la misma comodidad. Luz trifasica, gas natural, Agua de pozo c/bomba sumergible y tanque con automático, pozo nuevo. Pileta 4 x 8 con lajas térmicas.||||20 x 100||||True||||||[]|
lote en esquina, 10 mts x 35 mts + martillo. 224 m2, fot 3 mas premios, fos 0.6||3||10 x 35|True|||||||||[]|
Se trata de un terreno conformado por tres lotes de 8.66 x 50 mts. Zonificación: R2. Barrio residencial de baja densidad. F.O.S. máximo = 0.60. F.O.T. máximo = 2.2. Densidad neta potencial: 800 hab/ha. Altura máxima: R = h/d = 1.6. Altura máxima basamento: 6 m. Altura mínima interior P.B.: 2.80 m. Altura mínima interior sobre P.B.: 2.60 m||||8.66 x 50||||||||||[]|True
Lote de 15 metros de frente por 25 de fondo en excelente zona ubicada a 10 cuadras de la estación de Merlo, en zona residencial cercana al centro. Cuenta con planos aprobados para la construcción de dos duplex de 7.5 mts de frente cada uno. Zona bifamiliar. FOS 0.6. FOT 1. Información adicional: Tipo de terreno: Residencial FOS: 0.6. Zonificación: residencial. Estado de la propiedad: Muy bueno. Servicios: electricidad, pavimento, cloacas, gas, agua corriente. Características: Alambrado perimetral||1||15 x 25||||||||||[]|
Ideal para desarrollo Inmobiliario!! Ubicado en zona céntrica con amplio crecimiento de emprendimientos en altura; a 2 cuadras de la Av. Rivadavia; de la Plaza San Martín y de la Estación Ituzaingó del Tren Sarmiento. Superficie Total del Terreno: 450 m2. Con doble frente de 17.32 mts y 26 mts de fondo (Conformado por dos lotes de 8.66 x 26). Actualmente con vivienda construída en una planta (más una habitación con baño en 1er piso) de 250 m2 cubiertos. Fondo Libre. FOT 3. FOS 0.6. POSIBILIDAD DE INCORPORAR LOTE ADJUNTO A LA OPERACION||3||8.66 x 26;17.32 x 26||||||||||[]|True
