descripcion|direccion|fot|irregular|medidas|esquina|barrio|frentes|pileta|urb_cerrada|posesion|urb_semicerrada|preventa|indiviso|a_demoler|es_multioferta
Inmueble en venta ideal emprendimiento. FOT 2.5 FOS 0.6 Zona residencial multifamiliar. Terreno de 346 mts frente 8.66 x fondo 39 mts aprox. Todos los servicios. Chalet a demoler con pileta y quincho.||2.5||8.66 x 39||||True||||||[]|
Hermoso chalet sobre lote propio de 10 x 30 ubicado en Ituzaingó Norte (super residencial) a solo 5 cuadras de la estación (FOT: 2 FOS: 0.6). Cuenta con jardín al frente parquizado. Garage cubierto para un vehículo, pasante con portón automático. Gran living comedor en desnivel con hogar a (gas). Cocina comedor instalada con barra desayunadora, mueble bajo mesada y alacena, lavadero incorporado. Baño completo. En primer piso tres dormitorios y baño amplio compartimentado con bañera. Al fondo gran parque libre con pileta de natación y parrilla. Puede tomar departamento en menor valor.||2||10 x 30||||True||||||[]|
Excelente lote central en Barrio San Joaquín, rodeado de añosa arboleda, en un barrio totalmente consolidado. Escrituración inmediata. Inmejorable acceso sobre Ruta 39 a 2.000 m de la Ruta Panamericana y a 10 minutos del centro de Pilar. Amplio jardín con piscina.||||||Barrio San Joaquín||True||||||[]|
Hermoso lote interno de 625 mts de largo y 200 mts de ancho en Barrio cerrado San Simón. Muy buena ubicación dentro del barrio. VALOR DE VENTA USD 39.000|||||||||True|||||[]|
PRE VENTA de Lotes en Barrio Cerrado Estancia Piñero. Los terrenos son 500 m2, 12 metros de Frente y 40 de Fondo. Contamos con distintas orientaciones. Red de luz subterranea, red de agua, iluminación interna Led, calles pavimentadas, forestación en espacios recreacionales con circuitos aerobicos, laguna artificial y piletas con juegos para niños.||||12 x 40||Barrio Cerrado Estancia Piñero||True|True|||True||[]|
Terreno irregular 12.90 x 23.20 x 17.05 x 28.90. Superficie total 792.02 m2|||True|12.90 x 23.20 x 17.05 x 28.90||||||||||[]|
Casa de lote propio en esquina con terraza con parrilla. 5 ambientes en Flores. Por escritura figura la medida del terreno de 94 metros cuadrados. 4 metros de frente al NE. 8.27 metros en su otro frente al SE. 6 metros en su ochava al O. 8.45 metros en el costado SE. 12.30 metros en su costado NE. Ubicado en el barrio de Flores. A media cuadra de Av. Esteban Bonorino. A dos cuadras de Av. Carabobo.|||||True|||||||||[]|
Espectacular casa quinta en Barrio El Rodeo en La Plata. Acceso sobre ruta 215. muy buen entorno barrio familiar semi cerrado. la propiedad esta desarrolada sobre 4 lotes de 20 x 50 cada uno. la casa esta situada sobre dos lotes es de tipo chalet en una planta y consta de gran estar comedor con vista hacia la piscina||||20 x 50||Barrio El Rodeo en La Plata||True|||True|||[]|True
Casa de 96 m2 cubiertos sobre lote de 10 x 31 en venta. Living, cocina comedor, dos dormitorios, un baño, cochera cubierta para dos autos. Fondo con patio y espacio verde, lavadero, parrilla, pileta y pequeño galpón.||||10 x 31||||True||||||[]|
Casa en barrio cerrado San Facundo, 3 dormitorios uno con baño en suite, cocina comedor, living, pileta, quincho, entrada de autos||||||||True|True|||||[]|
Barrio Cerrado La Elisa importante propiedad desarrollada en una planta. Amplio living comedor con salida a la galería con vista a la piscina. Dos dormitorios, el principal con vestidor y baño en suit, playrom o tercer dormitorio. Dependencias de servicio con dormitorio y baño privado, lavadero. y cocina comedor. Cochera cubierta para dos vehículos.||||||Barrio Cerrado La Elisa||True|True|||||[]|
Excelente cabaña en Prados de La Vega, cuenta con 3 dormitorios, living comedor con cocina integrada, baño completo, galeria, cochera para 2 autos, excelente arbolada, y tanque industrial (pileta).||||||||True||||||[]|
CASA SUCRE. BELGRANO R. Casa sobre lote propio de doble frente (17.35 x 35) con balcones terraza, jardín, piscina, solárium y quincho con parrilla||||17.35 x 35||||True||||||[]|
Casa de doble frente de 20.903 m2 de lote. Toma departamento en parte de pago. Zona Olivos/Vicente López. La misma cuenta con un living comedor de 5 x 9.50 con pisos en cerámicos, gran cocina comedor diario refaccionada a nueva de 6.30 x 6.70 con mucha luz y vista y salida al parque, lavadero independiente, dependencia de servicio con baño, toilette con ducha. Calefacción central por radiadores. Gran parque arbolado con piscina, quincho, parrilla y entrada pasante para varios autos.||||6.30 x 6.70||||True||||||[]|
Terreno de triple frente en venta, entrada por Av San Martín (doble frente) y por Miguel ángel (frente simple). La de Av San Martín tiene 17.38 de frente X 48.55 de fondo, con posibilidad de construir 4032.2 m2 vendibles distribuidos en 7 pisos.||||17.38 x 48.55||||||||||[]|
Lote de terreno de doble frente (17.32 m) ubicado sobre la calle Olaguer en la ciudad de lomas del mirador. Posee portón de acceso corredizo, piso de hormigón en toda la superficie y cuenta con una oficina con baño. Medidas del Lote: 17.32 m frente x 43.30 m fondo. Superficie Total: 750 m2. Zonificacion: U2b Urbano Mixto. FOT: 2.25 FOS: 0.60. Densidad: 700 Hab||2.25||17.32 x 43.30||||||||||[]|
El terreno tiene una forma triangular con casi 300 metros lineales de frente a lo largo de la Avenida Presidente Alfonsín, 300 metros sobre la calle Olavarría y una base de 400 metros.|||True|||||||||||[]|
Lote en proceso de subdivisión de mayor lote, 15 x 49.75 + un martillo a favor en centro de manzana de 200 m2 (10 x 20), con galpón a demoler. Apto para gran emprendimiento. Valor U$S 680.000. Único lote ideal para emprendimiento inmobiliario. Extraordinaria ubicación a solo 200 metros de la Av. Colón, y de Av. Independencia. 400 de la Av. Luro.||||15 x 49.75||||||||||[]|
Importante lote martillo de 600 m2 en el centro de Villa Ballester, zonificación Rm 2, el mismo tiene 7.50 metros de frente por 50 de fondo y se ensancha a 15 metros de frente a los 20.22 metros. El ingreso a las habitaciones de planta alta es independiente ideal para desarrollo comercial, salón de fiestas o instituciones.||||7.50 x 50||||||||||[]|
Excelente lote en L con frente a la ruta 58 (Mariano Castex) Canning. El mismo posee 10 mts de frente sobre la ruta y 50 mts de fondo, un martillo de 10 mts x 40 mts (con frente a la calle lago mascardi).||||10 x 40||||||||||[]|
Vendo en Villa Carlos Paz, Villa Ernestina, lote en esquina. Zona residencial. Ubicado frente al complejo de cabañas Coty Ranch de Villa Ernestina. Las casas que se encuentran alrededor son de buena arquitectura. Está ubicado a 300 mts de un tranquilo río con generosas playas de arena y grandes rocas redondeadas. Se puede apreciar en las fotos. El lote en venta es el 135 (ver plano) en esquina. 37.69 mts de frente hacia el norte y 23 mts hacia el este. Valor del lote U$S 17.000.|||||True|||||||||[]|
Venta de Casa Multifamiliar en Villa Ballester, General San Martín. Propiedad con doble frente en lote de 17.32 x 18. Patio y jardín al frente, gran cocina comedor diario, 3 dormitorios, patio y jardín al contra frente, lavadero, galería semicubierta, cochera para 1 auto con portón automático. Al contrafente unidad independiente de 2 ambientes. Esta propiedad de 35 años de antigüedad y con una solida construcción tiene diversos beneficios a tener en cuenta, como ser los cambios que pueden hacerse en la distribución de la misma según las necesidades del comprador como lo pueden ver en el plano adjunto, posee muy buena iluminación en todos los ambientes con ventanas a alguno de los patios, lo que permite una buena entrada de aire. El inmueble es todo planta baja y ese es un gran beneficio ya que no se tendrá a futuro el problema de las escaleras, motivo de venta de muchos propietarios a cierto momento de su vida.||||17.32 x 18||||||||||[]|
Importante predio - lotes - en la mejor zona de Banfield, Lomas de Zamora. Apto ideal desarrollo inmobiliario. 4000 m2. Salida a dos calles. A 200 metros de Larroque y de Alvear. Zona residencial exclusiva. Predio a la venta en la mejor zona de Banfield, cerca de todo. Zona residencial ideal para desarrollo inmobiliario. 4000 m2 compuestos por 7 lotes, con medidas irregulares de 50 m de largo por 80 m de ancho. Doble frente con ingreso casi de 20 m. Salida a dos calles. 2.600.000 USD|||True|||||||||||[]|True
Partido de San Fernando PBA. Terreno en forma de L con su frente principal sobre la avenida y un segundo frente sobre la calle lateral Don Orione. Frente: 19.66 m, lateral derecho: 46.90 m, lateral izquierdo: 46.95 m, fondo: 26.20 m. Zonificacion: C2. Superficie: 2000 m2. F.O.T: 3. F.O.S: 0.6. Densidad: 900 Hab./Ha. Ret. Frente: No hay||3||||||||||||[]|
Frente triple a Rocha de 28.39 mts con fondo de 34.77 mts. Frente a Mazza de 12.31 mts con fondo de 50.50 mts. UF 1 en PH 3B: 584 mts. UF 2 en lote propio 366 mts. UF 3 en lote propio 674 mts. Sumatoria mts de tierra 1624 mts. Zonificación: Ex R6 con FOT 2.4 y FOS 0.6.||2.4||||||||||||[]|
Espectacular lote con salida a 2 calles. Doble frente en ambas calles, 17.32m. Superficie total del lote 1375m. Zonificación USAM: Planta baja, 5 pisos y 2 retiros (pueden ser destino vivienda). A media cuadra de Av. Nazca, variedad de comercios y múltiples líneas de colectivo. Metraje de construcción total de planta baja al piso 7, habiendo contemplado dos ventilaciones (cada una de 24m.): 7000m. Aproximadamente.|lote 1375m.|||||||||||||[]|
Excepcional lote céntrico con salida a 3 calles, con 14.15 metros de frente por Diagonal España, otros 30 metros por Córdoba y 10 metros por Teniente Ibáñez, a 250 metros de la Avenida Argentina. Superficie terreno: 1.177.90 m2. Superficie cubierta: 695.42 m2. Superficie semicubierta: 41.89 m2. El terreno es irregular, ideal para construcción en altura de complejo habitacional, comercial, centro médico y/o educativo. Zonificación: Zona Corredor Central CC2 y CP2. FOS: 0.85 %. Altura máxima: 42 metros.|||True|||||||||||[]|
Excelente terreno de 50 mts de frente x 83 mts de fondo con salida a 2 calles. Superficie del terreno 4150 m2. Zonificación UR2 B. FOT 0.9 ampliable a 1.05 abonando plusvalía. FOS 0.45. Altura máxima 10.5 mts + 3 mts retirados. Densidad 350 hab x ha. Actualmente consta de casa principal, casa de huespedes, amplio quincho cubierto, piscina, amplio parque arbolado.||0.9||50 x 83||||True||||||[]|
Casa construida en 2 plantas en el Barrio Cerrado Trapalanda, sobre la ruta 5. En planta baja: living, comedor, cocina integrada, 3 dormitorios, uno en suite, toilette. Lavadero separado, dependencia de servicio con baño completo. Planta alta: 2 dormitorios, uno en suite con vestidor. Jardin, galeria, pileta, parrilla||||||Barrio Cerrado Trapalanda||True|True|||||[]|
En excelente y estratégica ubicación, dentro de la zona del Puerto de Mar del Plata, se encuentra este importante lote en forma de L, con salida a dos calles. Con frentes de 17.30 mts sobre calle Bermejo y 8.71 mts sobre calle Solis, este lote cuenta con 1303 m2 totales. Emplazado sobre Distrito C2, zona destinada a la localización de usos urbanos centrales de índole administrativa, comercial, financiera, institucional y afines, compatibles con uso residencial de densidad media/alta. Con FOT 2.5 posee la factibilidad de construir aproximadamente 4.500 m2 en hasta 8 plantas.|calle Bermejo y 8.71|2.5||||||||||||[]|
Este impresionante chalet revestido en piedra, de techo de tejas rojas, aberturas de madera artesanales, luminoso, espacioso y funcional, está ubicado a dos cuadras de Avenida Sarmiento, a dos cuadras de Avenida 3 de Febrero, a 7 cuadras del centro de la ciudad y a 10 cuadras del paseo costanero, en una zona apacible y pintoresca. Construido estratégicamente en esquina, permite ambientes luminosos, ventilados y muy bien distribuidos, permitiendo una total funcionalidad. Cuenta con 4 dormitorios, 3 baños, cocina con desayunador, comedor, amplia sala, lavadero, patio con parrilla, jardín y una pequeña pileta.|||||True|||True||||||[]|
Lote en venta en esquina. Puede tomar metros construidos. Medidas sobre calle 17: 18.38. Ochava de 3 mts. Sobre calle 38: 5.85. Cierra el polÍgono de forma irregular (ver foto). Existe un local a demoler. Zona: u/c2b. Fos 0.6. Altura referencia en niveles 8. Fot comercial 2.7 Fot residencial 2.25. densidad comercial 1800. Densidad residencial 900. Premios 50% en fot y densidad||FOT comercial 2.7. FOT residencial 2.25|True||True|||||||||[]|
Lote de 8.66 x 44.70 (irregular), situado en el centro comercial de la localidad de Ciudadela. Con chalet de 4 ambientes 160 m2 aproximados cubiertos. Superficie del terreno: 374 m2. Superficie a edificar aproximada: 1122 m2. Zonificación C1. FOT: 3. FOS: 0.6. Densidad 1600. Posibilidades de tomar metros construidos o a construir||3|True|8.66 x 44.70||||||||||[]|
Lote CHACRAS DE LA RESERVA CARDALES A LA LAGUNA. LOTE EN VENTA DE 1.100 M2 EN CHACRAS DE LA RESERVA. Lote con hermosa arboleda. Vistas abiertas a la laguna y al campo. BARRIO ubicado a la altura del km 61 de Panamericana Ramal Escobar por Ruta 4. dos km para el lado de Los Cardales Una zona de grandes y extensas áreas verdes a muy pocos minutos del casco urbano de Los Cardales. el barrio cuenta con un espacio de 60.000 m2 para el desarrollo de un sector social y area verde de esparcimiento, Club House Cancha de fútbol y Tenis Pileta de Natación Sendas con vista a los espejos de agua. Espectacular paisaje con  quebradas. Seguridad privada las 24hs. SUM con parrillas juegos para niños. Sendero Ecológico|Lote CHACRAS DE|||||Club House Cancha|||True|||||[]|
Increíble lote de 14 m x 47.5 m. Excelente acceso a 150 metros de Ruta 2. El lote está ubicado sobre calle 406 Bis y Calle 202. Zona de casas quinta. Soy particular venta directa de dueño. Cuento con la escritura a mi nombre no es posesión ni usucapion el lote cuenta con servicio de energía eléctrica agua por perforación gas envasado. Escuelas comercios de cercanía muy lindo entorno Ideal para casa quinta o vivienda permanente|calle 406 Bis y Calle 202|||14 x 47.5||||||||||[]|
Lote interno (PH) en calle 512 bis e/ 8 y 9, tiene 9 mts de frente por 16 de fondo, con cochera descubierta compartida e ingreso al lote por pasillo interno. se encuentra en una zona Clave de Ringuelet a metros de Camino Centenario y de avenida 7. el lote cuenta con permiso de obra y planos|calle 512 bis e/ 8 y 9|||9 x 16||||||||||[]|
dueño directo vende lote de 1.300 metros forestado con fondo a Laguna al día y listos para escriturar y/o construir. es el lote 92 de Miralagos 2. posibilidad de adquirir el lote lindero de mismas características y dimensiones. evaluo permuta por mayor o menor valor|lote 92 de|||||||||||||[]|
AMPLIO LOTE EN VENTA EN MIRALAGOS CLUB DE CAMPO GOLF & SPA. el lote dispone de 1285 m2 ubicado en una calle poco transitable y cuenta con un fondo a la laguna del barrio. está ubicado cerca del segundo ingreso del barrio, con fácil acceso a la entrada al Club y a la entrada a la ruta 2. el barrio cerrado Miralagos Club de Campo Golf y Spa se encuentra solo a 30 minutos de la capital con vía directa cuenta con Club house, con pileta climatizada, piscina exterior, playroom, paddle, tenis, cancha de golf con 9 hoyos; spa y gimnasio orientacion. Frente al Suroeste. las medidas son aproximadas. Las definitivas surgirán del título de la propiedad. las medidas y superficie son aproximadas y no resultan vinculantes||||||Club house||True|True|||||[]|
37 e/ 17 y 18. terreno en inmejorable zona de la ciudad de La Plata barrio Norte. de 8 m de frente y 30 de fondo con una construcción a demoler o reciclar siendo que los techos y estructura están en buen estado a media cuadra de Plaza Guemes zona residencial |37 e/ 17 y 18|||8 x 30||barrio Norte||||||||[]|
"59 e/ 1 y 2. Venta importante lote apto desarrollo UC1 de 781 m2. Indicadores de puntos FOS 0.6 Altura en niveles 14. FOT Comercial 3, Residencial 2,5
"|59 e/ 1 y 2|3||||||||||||[]|
terreno de 418 mts2 en venta ubicado en calle 14 entre 68 y 69. La Plata Buenos Aires Con disposición frente y orientación sur regular entre medianeras cuenta con medidas de 8 mts de frente por 50 mts de fondo cuenta con un local al frente habilitado actualmente con actividad con entrada de vehículos y portón independiente al local acceso por calle de asfalto con todos los servicios disponibles en la zona|calle 14 entre 68 y 69|||8 x 50||||||||||[]|
"fincas de Duggan se encuentra ubicado a 15 minutos del centro de la ciudad y a 10 minutos del casco urbano de La Plata permitiendo toda la libertad y calidad de vida que ofrece el campo la tranquilidad de que nuestros hijos crezcan en pleno contacto de la naturaleza y el aire libre dentro un barrio consolidado de baja densidad con todas las posibilidades de optar en cuanto a medidas y superficies de lotes desde 700 a 1.200 m2 y con más de 100 familias viviendo y otras 60 etapa de construcción. FINANCIACION EN HASTA 48 CUOTAS EN PESOS. seguridad y vigilancia las 24 horas triple cerco perimetral electrificado servicios por tendido subterráneo. red de energía eléctrica, red de fibra óptica para Internet de alta velocidad telefonía y televisión. red de agua corriente red de gas natural
"|||||||||True|||True||[]|True
122 300 USD 80.000 Venta en La Plata, Buenos Aires Terreno 500 m2 Total. 10 mts Frente y 50 mts Fondo, Lote 500 m2, sobre avenida comercial Venta de Lote en Bº Hipódromo, La Plata lote de 10 x 50 mts. (500 m2) sobre avenida 122 próxima a Av. 38 cuenta con francos accesos al centro de la ciudad a la ciudad de Ensenada  Punta Lara y a la Autopista La Plata  Bs. As. ideal emprendimiento comercial sobre avenida 122 próximo a la esquina de avenida 38 estado a refaccionar ZONIFICACIÓN U/C3 (AREA URBANA/ Áreas de promoción y Corredores de Acceso Principal y Complementaria) apto para desarrollo constructivos o comerciales ya que se permiten construir hasta 6 Niveles Fos 0.6/ Fot Res. 2 Fot Com. 2.4/ Den Res. 800 Den Com. 1.600/ Premios 30% en FOT y DEN|Lote 500|2||10 x 50|True|||||||||[]|
Barrio abierto con 150 lotes entre 200 y 500 m2 distribuido en 6 manzanas A 15 minutos del centro platnese ubicado entre las calles 608 entre 18bis y 20 rápido acceso alejado del ruido de la ciudad encontra el lugar para tu futuro hogar|calles 608 entre 18bis y 20|||||||||||||[]|True
venta de lote irregular en 520 y 172 de 5135.50 m2. Melchor Romero cuenta con tendido eléctrico, agua, factibilidad de gas todos cuentan con escritura individual e inmediata lote en manzana 161-w. posibilidad de financiación venta directa.|||True|||||||||||[]|
lote en venta con fondo al agua. Barrio cerrado Miralagos el lote dispone de 1285 m2 ubicado en una calle poco transitable y cuenta con un fondo a la laguna del barrio está ubicado a cerca del segundo ingreso del barrio con fácil acceso a la entrada al club y a la entrada a la ruta 2 el barrio cerrado Miralagos club de campo golf y spa se encuentra solo a 30 minutos de la capital con vía directa cuenta con club house con pileta climatizada piscina exterior playroom paddle tenis cancha de golf con 9 hoyos spa y gimnasio orientacion Frente al Suroeste las medidas son aproximadas las definitivas surgirán del título de la propiedad||||||||True|True|||||[]|
zona U/C1 area Central residencial. Central caracteristica es el ambito de centralidad donde se promueve preservar las caracteristicas significativas ambientales y culturales se caracteriza con usos institucionales administrativos de alcance regional comerciales y residenciales se promueve una elevada intensidad de ocupacion del suelo y multiplicidad de actividades. FOS 0,6. ALTURA REFERENCIA EN NIVELES 10. FOT COMERCIAL 3. FOT RESIDENCIAL 2,5. DENSIDAD COMERCIAL 2000. DENSIDAD RESIDENCIAl 1000. PREMIOS 70% en FOT Y DENSIDAD||FOT RESIDENCIAL 2,5. FOT COMERCIAL 3||||||||||||[]|
Venta de Lote en Barrio Hipódromo, La Plata. Lote sobre avenida 38 de 328 m2 superficie, el mismo posee zonificación U/C3 (AREA URBANA/ Áreas de promoción y Corredores de Acceso Principal y Complementaria) apto para desarrollo constructivos o comerciales ya que se permiten construir hasta 6 Niveles (Fos 0.6/ Fot Res. 2; Fot Com. 2.4. Den Res. 800; Den Com. 1.600/ Premios 30% en FOT y DEN.), el mismo cuenta con una casa de 3 dormitorios, cocina comedor, baño y garage, la misma se encuentra a reciclar o demoler. Morfología irregular, medidas 7.54 x 39.82 x 9.43 mts.||FOT residencial: 2. FOT comercial: 2.4|True|7.54 x 39.82 x 9.43||Barrio Hipódromo||||||||[]|
Terreno en venta. Lote irregular de 131 m2. Con frente de 8.76, un lateral de 16.8 y otro lateral de 13.6. FOT 2.5||2.5|True|||||||||||[]|
Sobre la calle Lope de Vega al 2600 frente al Club de Golf San Martín y a cinco cuadras de Gral Paz, encontramos este lote irregular de 10 metros al frente y 11,91 al fondo y de 48 metros en uno de sus lados en tanto que el restante asciende a 53 metros. Buena ubicación y excelentes medidas.|calle Lope de Vega al 2600||True|10 x 11.91||||||||||[]|
Se trata de un galpón de tres frentes, ubicado sobre Av. De los Quilmes N° 1540/1550 a escasos metros del triangulo de Bernal, en zonificación R3 (permitiendo industrias de actividad inocua) de excelente acceso y de salida rápida a autopista Buenos Aires la Plata, diferentes puntos del conurbano como así también a Capital Federal. Galpón N° 1540: Implantado sobre dos lotes de terreno. En su primera mitad de 14,80 mts x 50 mts x 25,70 mts. Sup. Cubierta: 380.3.|sobre Av. De los Quilmes N° 1540/1550|||14.80 x 50;50 x 25.70||||||||||[]|True
Lote con mejoras (casa a refaccionar) 8,77 x 26,23 x 8,77 x 26,07, sup. total 226 mts2. Todos los servicios. FOS 0.6. FOT 1.6. Zonificación RTMA. Escritura a cargo del comprador.||1.6||8.77 x 26.23 x 8.77 x 26.07||||||||||[]|
Departamento de un dormitorio en alquiler ubicado sobre Avenida 44 entre 8 y 9 (La Plata, Buenos Aires). Desarrollado en planta baja, con disposición interna y orientación al norte. El mismo posee cocina independiente equipada con muebles sobre y bajo mesada, living comedor, un dormitorio con placard empotrado y un baño completo. Amplio y luminoso, cuenta con patio interno. La propiedad tiene una superficie total de aproximadamente 38 mts2, de los cuales 33.5 mts2 son cubiertos.Las expensas al día 17/04/2024 son de aproximadamente $17.000.|Avenida 44 entre 8 y 9|||||||||||||[]|
Departamento de un dormitorio en venta ubicado sobre calle Almirante Brown entre 9 de Julio y Republica Oriental del Uruguay (Morón, Buenos Aires). Desarrollado en piso alto por ascensor, con disposición frente y orientación al sur.El mismo posee cocina independiente equipada con muebles sobre y bajo mesada, living comedor, un dormitorio con placard empotrado y un baño completo. Amplio y luminoso, cuenta con balcón y equipo de aire acondicionado central.La propiedad tiene una superficie total de aproximadamente 48mts2, de los cuales 43mts2 son cubiertos. Las expensas al día 17/04/2024 son de aproximadamente $104.000.|calle Almirante Brown entre 9 de Julio y Republica Oriental del Uruguay|||||||||||||[]|
Departamento de un dormitorio en venta ubicado sobre calle 17 entre 40 y 41 (La Plata, Buenos Aires) Desarrollado en primer piso por ascensor, con disposición contrafrente y orientación sur.Dispone de cocina equipada con muebles sobre y bajo mesada semi integrada mediante una barra desayunadora al living comedor, un dormitorio con placard empotrado y un baño completo. Amplio y luminoso, cuenta con balcón.Cochera descubierta con capacidad para un vehículo.Las expensas al día 08/02/2024 son de aproximadamente $15.000.La propiedad cuenta con una totalidad de 44mts2, de los cuales 41mts2 son cubiertos.|calle 17 entre 40 y 41|||||||||||||[]|
"Lotes en venta en Club de Campo Estancia Chica; el emprendimiento tiene como objetivo la realización de un barrio privado como complemento del complejo deportivo y recreativo ""Estancia Chica"".Muy bien ubicado, comprendido entre la ruta 36, calle 498, calle 202, diagonal 197 y calle 476; con fácil accesibilidad a La Plata (centro), City Bell y Capital Federal, alejado del tráfico y el ruido de la ciudad; un lugar para disfrutar en familia con grandes espacios recreativos y deportivos.EL PROYECTO El loteo a urbanizar consta de 742 lotes, de 20 metros de ancho por 30 metros de profundidad cada uno, con una superficie de 600 metros cuadrados. Se trata de un área de 88 hectáreas que en forma de herradura abraza y rodea al casco de Estancia Chica.URBANIZACIÓN Se comercializan 50 lotes en la 1° Etapa de PREVENTA, dispuestos a la derecha del acceso de calle 202 y 498. Ya se están realizando los primeros trabajos de desmalezado, trazado y consolidación de los lotes y calles que conformarán la primera etapa, red de agua potable, tendido eléctrico y luminarias de espacios comunes, alambrado perimetral y construcción de los pórticos de acceso. La siguiente etapa de obras de infraestructura comprende el desarrollo del sistema de desagües pluviales a cielo abierto, provisión de internet por fibra óptica, el sistema de provisión red cloacal, cumpliendo así con las requisitorias para el desarrollo de obras por parte de los entes gubernamentales.En la segunda etapa se comercializarán y urbanizarán los 398 lotes que se encuentran a la derecha del izquierda de calle 202 y 498, paralelo al Diagonal 197 y calle 476.Lotes propios. Escritura Inmediata dentro de los 60 días de conformada la reserva. Escribano Designado"|diagonal 197 y calle 476|||||"Estancia Chica"""|||True|||True||[]|True
