descripcion|direccion|fot|irregular|medidas|esquina|barrio|frentes|pileta|urb_cerrada|posesion|urb_semicerrada|preventa|indiviso|a_demoler|es_multioferta
 Terreno en venta - 200 mts2 - La Plata Terreno en venta ubicado sobre calle 19 entre 75 y 76 (Altos de San Lorenzo, La Plata, Buenos Aires) Con disposición frente y orientación norte.De medidas regulares, cuenta con 10mts de frente por 20mts de fondo, contabilizando 200mts2 totales de superficie, de los cuales 40mts2 pertenecen a una casa a demoler o refaccionar de dos dormitorios, con cocina, living comedor y un baño. Con acceso por calle de asfalto, cuenta con los servicios de electricidad, agua corriente, gas natural y cloacas disponibles en el lugar.índices de prefactibilidad: FOS 0,6 ALTURA REFERENCIA EN NIVELES 3 FOT COMERCIAL 1,2 FOT RESIDENCIAL 1,2 DENSIDAD COMERCIAL 300 DENSIDAD RESIDENCIAL 300 RETIROS Y REQUISITOS Laterales: Se permite solo un retiro respecto los ejes medianeros. COCHERAS OBLIGATORIO PROVISION DE COCHERAS: 60% DE UNIDADES DE COMERCIO/VIVIENDA/OFICINA EN LOTES DE FRENTE MAYOR A 12 mts. Y SUPERFICIE MAYOR A 375 m2 PARCELAMIENTO MINIMO FRENTE 15 PARCELAMIENTO MINIMO SUPERFICIE 375 RELACION FTE / FDO 1/3|calle 19 entre 75 y 76|FOT RESIDENCIAL 1,2. FOT COMERCIAL 1,2||||||||||||[]|True
MIRALAGOS. Club de Campo Golf y Spa. Ubicado en MIRALAGOS Club de Campo Golf & spa (La Plata, Buenos Aires). VENTA Terreno de 1285 mts2 con fondo a la laguna. Las medidas aproximadas de 20 mts de frente por 60 mts de fondo.Acceso por calle de tierra mejorada con servicio de electricidad en la zona. Características: Red de Energía eléctrica Red de fibra óptica para telefonía, internet, etc.Red de Agua corrienteRed de Gas natural Derecho de Conexión a Red cloacal con planta de tratamiento interna.Calles con pavimentación asfáltica Alumbrado de calles Seguridad y vigilancia las 24 horas Gimnasio & Spa, Cancha de Golf , 6 Canchas de Tenis, Canchas de Futbol 5 y 11, Cancha de Paddle, Canchas de Beach Voley, Polideportivo (básquet, patinaje, handball, hockey),Circuito aeróbico. El mismo concepto fue aplicado para el agua servida, esta es tratada y desechada en tu totalidad en una única red que se conecta a una importante planta de tratamiento propia construida con la última tecnología, que trabaja sin provocar ningún tipo de ruido y con ausencia de olores.La información gráfica y escrita contenida en el presente aviso es meramente a título ilustrativo e informativo y no forma parte de ningún tipo de documentación contractual.Las medidas y superficies definitivas surgirán del título de propiedad del inmueble referido. Asimismo los importes de tasas, servicios y expensas indicados están sujetos a verificación||||20 x 60|||||True|||||[]|
Venta de Lote en Fincas de Duggan. Boero Propiedades vende Lote 225 Etapa 3: Fincas de Duggan se encuentra ubicado a 15 minutos del centro de la ciudad y a 10 minutos del casco urbano de La Plata, permitiendo toda la libertad y calidad de vida que ofrece el campo.La tranquilidad de que nuestros hijos crezcan en pleno contacto de la naturaleza y el aire libre, dentro un barrio consolidado, de baja densidad, con todas las posibilidades de optar en cuanto a medidas y superficies de lotes: desde 700 a 1.200 m2., y con más de 100 familias viviendo y otras 60 etapa de construcción.El lote 225 cuenta con mayor privacidad, debido a que está ubicado en uno de los cul de sac. FINANCIACION EN HASTA 48 CUOTAS EN PESOS!Seguridad y Vigilancia las 24 horas. Triple Cerco Perimetral Electrificado.Servicios por tendido subterráneo: Red de energía eléctrica. Red de fibra óptica para Internet de alta elocidad, telefonía y televisión. Red de agua corriente. Red de gas natural.|lote 225 cuenta|||||||||||True||[]|True
Terreno en venta 192mts2 La Plata Terreno en venta ubicado sobre calle 39 entre 19 y 20 (La Plata, Buenos Aires) Con orientación sudeste y disposición frente.De medidas regulares, cuenta con 8mts de frente por 24mts de fondo, contabilizando una superficie total de 192mts2. Acceso por calle asfaltada con los servicios de electricidad, agua corriente y electricidad disponibles en la zona.|calle 39 entre 19 y 20|||||||||||||[]|
Lanzamiento Barrio Liquidambar. Calle 41 a 42 y de 149 a 150. Lote de 10 x 32. Sector privado. Preventa lotes ubicados a 200 mts de Av.44 , a 10 minutos del centro de La Plata y con facil acceso a Ruta 2 y 36 o Av.520. El barrio contara con lotes en el sector abierto y lotes cerrados que van desde los 160 a 400 mts2. Lotes comerciales con frente Avenida 149. |Ruta 2 y 36|||10 x 32||Barrio Liquidambar||||||True||[]|True
LOTES EN VENTA DESARROLLO BARRIO CERRADO EL MOLINO. CLUB DE CAMPO. Lotes en venta Desarrollo de barrio El Molino Club De Campo.  Ubicado en Ruta 2  Calle 531 Entre las rutas 2 y ruta 6. Lotes de: 15m x 30m = 450m2. 20m x 48m = 960m2. Lotes escriturables en parte indivisa. Posibilidad de financiar en los lotes de: Usd 6.000 contado: usd4.000, financiado en 12 meses de usd 170. Usd 11.000, contado: usd6.000, financiado en 12 meses de usd 450. El desarrollo contará con: Seguridad privada. Tendido eléctrico. Un muy buen movimiento de suelo. Una buena construcción tanto en Entrada como en La Garita de seguridad. Con ingreso exclusivo para los Propietarios y otro ingreso para los Servicios a su requerimiento. Con un excelente acceso y conexiones tanto Av. 520 & Av. 44. Salida rápida a Ruta 2 y Ruta 6  En una zona con un entorno natural. De campo.  Ideal para tu casa de fin de semana  Primeros terrenos disponibles en Preventa.|Av. 520 & Av. 44|||||barrio El Molino Club De Campo|||True|||True|True|[]|True
Fincas Don Eugenio II, un nuevo emprendimiento Situado en hermosa zona de estancias, rodeado de naturaleza y tranquilidad. Está ubicado en la Localidad de Gral. Rodríguez a 40 de Capital Federal y 15 de Acceso Oeste. Por Ruta N 6 Calle CAMINO NAVARRO. Cuenta con lotes a partir de los 300m2. Sus Valores los podemos identificar en plano como n colores: VALOR HASTA EL 26/03/2023 USD 10.948 EN LOTES SELECCIONADOS O LOTES DESDE USD 15.640. La posesión de los lotes son a 3 meses aproximadamente. Todos los lotes se entregan con quincho , parrilla y cerco de Alambre. Cuando se realiza la posesión se comienza a pagar un mínimo de expensas de $3.000, luego cuando todos los espacios en común estén terminados, se pagará $7.000 mensuales . El Barrio cuenta con ESCRITURA. Para que cada propietario pueda escriturar , deberá esperar un plazo estimativo de 1 a 2 años , ya que la ley nos pide tener un 60% del Barrio loteado. Porque se escritura por partes indivisas. Contamos con Normativas de Construcción , es importante leer con detalle. Respecto a los modelos de casas , hay flexibilidad. Se pueden construir Casas  en seco, Casas Alpinas, Cabañas, de material o estilo Streel Framing. No contamos con Financiación.|Por Ruta N 6|||||||||||||[]|True
"Muy buen lote en barrio cerrado Area 60, forma parte del barrio interno ""La Victoria Polo Country Club"". Lote 307, cercano a la entrada principal. Muy buena superficie de 1171,39 m2 con un frente de 32,25 x 40,00 m., y al fondo se angosta a 26,32 m. El barrio cuenta con club House, Club de Polo, canchas de polo, de tenis, de fútbol, piscina y sector de actividades náuticas. Se escucha alguna oferta."|Lote 307,|||32.25 x 40.00||Country Club||True|True|||||[]|
Lote en venta en Sicardi. Lote ubicado en el barrio cerrado fincas de Don Juan en calle 635 y 119, a pocas cuadras del camping de Salud publica, asfalto hasta 300 metros del barrio. El mismo posee unas medidas de 10 x 40 haciendo una superficie de 400 m2.|calle 635 y 119|||10 x 40|||||True|||||[]|
ESTRUCTURA JURíDICA: Fideicomiso a precio cerrado. EL VALOR PUBLICADO ES CONTADO EFECTIVO. Medidas: 15,5 x 25m La entrega del barrio esta programada para mediados 2023, no obstante, se permitirá dar inicio a las obras particulares a fines del 2022.  FORMA DE PAGO: Opción A: Contado en USD Opción B: 50 % anticipo USD + Cuotas hasta Dicembre 2024 U$S98.813.- UBICACIóN: A 200 mt de la bajada de Ruta 26, Ramal Pilar km 41,5. ESQUEMA DE RETIROS: INFORMACIóN GENERAL: Los lotes rondan los 375 a 400 mts 2. Superficie a construir mínima inicial permitida es de 120 m2 FOS: 0.4 FOT: 0.7 Retiro frente: 3 metros Retiro lateral: 1) 3.00 mt - 2) 1,15 mt Retiro Fondo mínimo: 8.00 mt. Pileta despegada de los ejes medianeros 1.50 mt. INFRAESTRUCTURA: Calles internas asfaltadas / hormigón intertrabado con cuneta. Redes subterráneas de electricidad, agua, cloaca y gas. Alumbrado Público. Pilares de servicios. Edificio de acceso.  Club House.  Amenities ||0.7||||Club House|||True|||True||[]|True
Potosi esquina Colectora calle Mimosas (ex COLPAYO). Medidas y valores: Lotes 12x 30 mts USD 11.000. Lotes 12x25 mts USD 10.000. SE ACEPTA FINANCIACION DEL 50% DEL VALOR Y CUOTAS! ACEPTAMOS PROPUESTAS! NUEVO CONDOMINIO CERRADO. A solo 10’ de la Autopista Pte. Peron con una inmejorable ubicación, tranquilidad y espacios verdes para disfrutar en familia. CONTARA CON:  LUZ, SEGURIDAD, CERCO PERIMETRAL, PLAZAS DISTRIBUIDAS EN TODAS LAS MANZANAS. Calles de tosca y mejorado pavimental. LOTES DE 15x35. VALORES PREVENTA PRIMERAS 25 UF DE: U$D10.000 (contado). U$D12.000 (financiado). ACEPTAMOS CUOTAS O PROPUESTAS PERSONALIZADAS PARA LA COMODIDAD DE CADA CLIENTE! APTOS PARA ESCRITURAR DE MANERA INMEDIATA.|||||True||||True|||True||[]|True
Venta de Lote en Calle 600 y 18 Altos del Plata, Villa Elvira, La Plata. Medidas de 18 x 31. Lote de 558 m2 Totales. Servicios de Luz y Agua corriente. Calle de tierra. El lote se encuentra cerrado un Cerco premoldeado a la altura de 2 metros. También hay una construcción con el proyecto de tener 100 metros cubiertos de superficie. Precio U$D25.000, Se Vende por Boleto con Posesión próximo a escriturar la parte indivisa.|Calle 600 y 18|||18 x 31|||||||||True|[]|
VENTA TERRENO DE  22,52 X 43,30, GENERAL SAN MARTIN Ideal constructor Excelente lote sobre Güemes entre las de Rivadavia y Vidal. El mismo cuenta con una superficie total de 975 m2. sobre lote de 22,52 de frente x 43,30 mts de fondo A la fecha se puede escriturar el 60% del terreno el 40% restante se encuentra en etapa judicial ( usucapión)||||22.52 x 43.30||||||True||||[]|
San Jerónimo ll BARRIO ABIERTO. Este emprendimiento esta ubicado en Matheu, partido de Escobar a 8 cuadras de la ruta 25 (Av. Sarmiento) con acceso a panamericana Ruta Nacional Nº 9 (ramal Escobar), a 15 minutos del Centro de Belén de Escobar. Este emprendimiento se desarrolla bajo la modalidad de precio cerrado y diferentes opciones de financiación en cuotas fijas. Contará con calles con cunetas, red eléctrica aérea y alumbrado LED. Oferta lanzamiento, Lotes en Matheu a precios únicos. Luego del éxito San Jerónimo 1, nace esta nueva propuesta de nombre San Jerónimo 2, son todos lotes con las medidas justas para poder realizar tu propio proyecto, tanto para vivienda permanente o para casa de fines de semana. San Jerónimo 2 va a convertirse en una excelente propuesta con visión de futuro, con comparativos demostrables en San Jerónimo 1, cuyos valores actuales se duplicaron en poco tiempo, hoy podes tener la posibilidad de reservar tu terreno al mejor precio del mercado. No dudes en contactarnos y reservar tu terreno. El precio publicado es por el anticipo, luego podes acceder a planes de 12 o 24 cuotas fijas. Los precios de lotes por pago de contado arrancan en u$s 10.000.|con acceso a panamericana Ruta Nacional Nº 9|||||BARRIO ABIERTO||||||True||[]|True
Hermoso loteo semicerrado en Cardales con financiación!!! Lotes de 1500 y 2000m2. Vistas abiertas al campo. Canchas de fútbol, plaza y sector aeróbico. A 1000m de Ruta 4, en zona de plena expansión. Cercano a colegios y comercios. Digno de visitar. Aproveche la etapa de preventa!!! Pagá un anticipo de usd y el saldo en 6 cuotas!!|||||||||||True|True||[]|True
"Terreno en venta dentro de un loteo semi-cerrado ubicado en calle 22 y 619, La Plata. Loteo ""Terrazas del Sur"". 1250m2. 25 metros de frente por 50 metros de fondo. Lote interno. Instrumento de venta. Fideicomiso. Desarrollo en pleno cecimiento, zona muy tranquila. "|calle 22 y 619|||25 x 50|||||||True|True||[]|
Zona rural, predio cerrado, semiprivado de 16x25mts, lote 6 excelente ubicaion con arbolado, todos los servicios|lote 6 excelente||||||||||True|||[]|
Excelente lote de 320 mts. ubicado en General Rodríguez. Barrio semicerrado a 10 minutos del centro de General Rodríguez y A 4000 MTS del Acceso Oeste frente al un club de polo. Inmejorable ubicación.|||||||||||True|||[]|
Terreno en barrios las Luciernagas, Arana. Zona muy tranquila, el terreno tiene 26 x 32 y cuenta con alambrado. Escritura en parte indivisa||||26 x 32|||||||||True|[]|
Lote en venta sobre calle 148 esquina 477. BARRIO LAS LIEBRES. Lindero con el Club de Campo Grand Bell. De medidas 24 x 56 mts., haciendo un total de 1.320, m2. LOTE N° 2 SEGUN PLANO Cuenta con una hermosa vegetación, alambrado perimetral y servicio de luz. Escritura por parte indivisa|calle 148 esquina 477|||24 x 56|True|BARRIO LAS LIEBRES|||True||||True|[]|
Gran oportunidad, apto Procrear. Avenida 38 y 147 San Carlos, exclusivos loteo 10 x 28 mts (PH) en barrio semicerrado ALTOS DE DON PEDRO a minutos de la Ciudad, servicios, apto Banco, totalmente independiente o sea no es parte indivisa. Muy buenas perspectivas, zona en progreso. Posibilidad de financiación particular a convenir. Desde U$D 24.900|Avenida 38 y 147|||10 x 28|||||||True||True|[]|
Lote en PH Barrio Abierto Don Uriel. Ubicación: Mz 146, lote 25. Lote de 235,38 m2 (10,81m X 23,19m) Servicios: Calles con cordón cuneta y mejorado. Red de tendido eléctrico. Alumbrado publico con luminarias LED. Agua corriente. Gas natural.  Sistema de venta por Fideicomiso con asignación de lote individual (no indiviso).|lote 25.|||10 x 23||Barrio Abierto Don Uriel|||||||True|[]|
Lote 5 es una CESIÓN, por lo tanto paga sellos el COMPRADOR. Se trata de una parcela de 795m2 que forma parte del barrio privado Finca Pueyrredón en un exclusivo predio de 1.260m2 con barranca al río y enmarcado en un maravilloso parque de especies añosas. FOT 0.90, FOS 0.45, Alt máx. 8,50m Retiro de frente: 5m. Retiros laterales: 3m. Forma de pago: 40% en USD a la adhesión 57% en cuotas 3% posesión |Lote 5 es|0.90||||Finca Pueyrredón|||True|True||True||[]|
Las Toninas, ciudad balneario del Partido de La Costa en la provincia de Buenos Aires, ubicada a 337 km de la Ciudad de Buenos Aires. Excelente lugar de ambiente familiar, con playas angostas de arena fina y aguas tranquilas, especial para proyectos o inversión. El terreno en venta se encuentra ubicado a 4 cuadras de la playa, sobre la calle 7 entre la 6 y 8 y cuenta con todos los servicios: agua, luz, gas y con todos los impuestos al día. A tener en cuenta: Se encuentra en proceso judicial de usucapión iniciado a los fines de obtener el título de propiedad. Posibilidad de otorgar cesión de derechos litigiosos. Con opción de financiación de dueño directo. ||||||||||True||||[]|
Venta de Lote en barrio santa Isabel Highland Park , Mar del Plata . Ponemos a la venta 4 lotes de 20 x 47 metros cada uno, en  trámite de escrituración por usucapión, ubicados en la fracción 1 sobre la calle 749 asfaltada entre las calles 116 y 118, en barrio Highland park, pegado a golf. Marayui Country Club lotes a la venta, sobre la calle asfaltada 749 fracción 1, lotes 2 lote  3 lote  4 y lote 5. cada uno de 20 por 47 metros.  los lotes están judicializados por tramite de usucapión, y se ha hecho cesión de derechos por escribanía, y se hará cesión de derechos y posesión al comprador en escribanía.  tenemos toda la información pertinente de los lotes citados, se entrega con impuestos de Arba y municipal al día de la transferencia, los impuestos pagados son de Arba y municipal.|calles 116 y 118|||20 x 47;20 x 47||barrio santa Isabel Highland Park|||True|True||||[]|True
Lote de 253m2 a 600 metros del centro de San Vicente y 300m de la Laguna de San Vicente. Dependiendo el sector, disponibilidad de escritura o prescipción adquisitiva (usucapión - 20 ya años cumplidos). El barrio se encuentra en pleno desarrollo, es abierto y en un futuro pasará a ser cerrado.  Servicios: Luz y agua y cloaca de pozo.  Ya hay gente viviendo en el barrio||||||||||True||True||[]|
LOTES EN VENTA EN TRISTAN SUAREZ, SOBRE CALLE LOS GIRASOLES ENTRE GADHINI Y MORENO MEDIDA DE CADA LOTE 10X35  VALOR DE CADA LOTE U$S 10.000 c/u.POSIBILIDAD DE FINANCIACION  SE VENDEN JUNTOS O SEPARADOS  Cesion de derechos posesorios|CALLE LOS GIRASOLES ENTRE GADHINI Y MORENO MEDIDA DE CADA|||||||||True||||[]|True
Fraccion en venta en la localidad de Pavón, partido de Exaltación de La Cruz, sin mejoras. Escritura de derechos posesorios.||||||||||True||||[]|
dueño directo vende lote de 1.300 metros forestado con fondo a Laguna al día y listos para escriturar y/o construir. es el lote 92 de Miralagos 2. posibilidad de adquirir el lote lindero de mismas características y dimensiones. evaluo permuta por mayor o menor valor|lote 92 de|||||||||||||[]|
Lote en venta en Magdalena, La Plata. San Martin y Junín. Lote en venta ubicado en el casco de Magdalena de 622,5 mts2.Excelente ubicación, zona consolidada con buenos accesos, a un paso del centro y diversos centros culturales de la Ciudad, cuenta con todos los servicios. Son lotes geodésicos, con escritura y partida inmobiliaria individual, con el mejor valor del mt2 -u$s34 dls- Oportunidad. Posesión inmediata. LIKEUS S.A no ejerce el corretaje inmobiliario. El presente sitio web es una plataforma en donde cada oficina inmobiliaria independiente que contrata los servicios LIKE Propiedades puede publicar las propiedades a su cargo. Cada oficina es de propiedad y gestión independiente, por lo que LIKEUS S.A no interviene en los datos de la publicación, en la operación inmobiliaria, ni en la confección y/o firma del boleto de compraventa y/o escritura y/o contrato de alquiler. En cumplimiento de las leyes vigentes que regulan el corretaje inmobiliario, Ley Nacional 25.028, Ley 22.802 de Lealtad Comercial, Ley 24.240 de Defensa al Consumidor, las normas del Código Civil y Comercial de la Nación y Constitucionales, los agentes/gestores/Likers NO ejercen el corretaje inmobiliario. La información gráfica y escrita en el presente aviso es meramente a título estimativo y no forma parte de ningún tipo de documentación contractual. Las medidas y superficies descriptas en el presente son aproximadas, las definitivas surgirán del título de propiedad del inmueble referido. Asimismo los importes de tasas, servicios y expensas indicados están sujetos a verificación. El valor del inmueble indicado en el presente puede ser modificado sin previo aviso. Operación supeditada a que el propietario cumplimente con la Reg.2371 COTI. Todas las operaciones inmobiliarias son objeto de intermediación y conclusión por parte del martillero y corredor público JUAN MARTIN BANEGAS CMCPDJLP 7694||||||||||||||[]|True
CAMPO EN GENERAL RODRIGUEZ ESPECTACULAR CAMPO DE 47 HECTAREAS SOBRE RUTA 24 A METROS DE RUTA 6. INMEJORABLE UBICACION 47 HAS Y 900 M2 SOBRE RUTA 24. La venta de este inmueble esta sujeta a la tramitación del Código de Transferencia de Inmuebles (COTI), de conformidad con la normativa vigente (Res. AFIP 2371/08, 2439/08 y ccs.) por parte del propietario|RUTA 24 A METROS DE RUTA 6|||||||||||||[]|
Lote de 12m x 39m , 468 m2excelente zona en El Pato, El Peligro, todos los servicios. El lote es con escritura, dueño directo. Todos los papeles al día y a disposición de los interesados. Se encuentra sobre Calle 406 bis y Calle 202 . Excelente acceso desde Caba. Zona de casas quinta. Comercios en cercanía, escuelas. Comuníquese por Whatsapp y le envío la información.|Calle 406 bis y Calle 202|||||||||||||[]|
Increíble lote de 14m x 47,5m Excelente acceso a 150 metros de Ruta 2. El lote está ubicado sobre calle 406 Bis y Calle 202. Zona de casas quinta. Soy particular, venta directa de dueño. Cuento con la escritura a mi nombre. No es posesión, ni usucapion. El lote cuenta con servicio de energía eléctrica, agua por perforación, gas envasado . Escuelas, comercios de cercanía, muy lindo entorno. Ideal para casa quinta o vivienda permanente. No acepto permutas y no financio. Su consulta no molesta. Visítelo, que realmente vale la pena. Comuníquese directamente al Whatsapp 1569899268 y envío información|calle 406 Bis y Calle 202|||47||||||||||[]|
"*VENDO LOTE barrio Los Chañares, Tanti, Punilla lotes de 700m2 (20x35) Derechos Posesorios de mas de 50 años. Listo para Usucapión. *SERVICIOS DE AGUA Y LUZ A CONECTAR.
*Video/Fotos: https://youtu.be/J8vYzQvuZU / https://nicolashnos.com/terreno-venta-tanti-punilla/5718348
*Geolocalización: https://goo.gl/maps/XfYgFekUqMj3zmBm8"||||||barrio Los Chañares||||True||||[]|True
"Casa con poco tiempo de uso, de dos plantas: En planta baja living comedor, baño, cocina. En planta alta dos habitaciones.
Se encuentra sobre 1200 mts de terreno los cuales pueden comprarse juntos o separados (cada uno 600 mts) tiene cada unos sus planos.
Es una posesion y la misma esta perfectad de papeles para hacer la escritura.
Tiene una vista preciosa a las sierras!
Consulte para ver sin compromiso!"||||||||||||||[]|
"TERRENO ZONA DE ALVEAR Y CAñADA, CORDOBA, cerca de Nueva Córdoba, 264mts2,  terreno irregular, ideal para emprendimiento, Derechos posesorios de mas de 25 años. Oportunidad de negocio!!! 
ESCUCHO OFERTAS DE CONTADO.  PRECIO PUBLICADO: RECIBO VEHICULOS (1, 2, 3 ó 4) que no sean de alta gama ni invendibles, autos nacionales, vendibles, fáciles de hacer efectivo.
LLAMAME LUCíA CORONEL RUIZ. Visitá nuestra web y enviame un Whatsapp (LU) por las propiedades que quieras ver!.MP 4199"|||True|||||||True||||[]|
VENDO LOTE SALSIPUEDES 450 mts (15 x 30) con 20 años cumplidos de posesión a 3 cuadras del Hotel IMOS con Cesion de Derechos confeccionada en Escribanía.|LOTE SALSIPUEDES 450|||15 x 30||||||||||[]|
"Inmobiliaria Perez Ferrero vende:
LOTE en Villa pan de azúcar - Cosquin
superficie total: 1739 mts2
posee medidor con servicio de luz eléctrica y también medidor con servicio de agua corriente.
ública de cesión de derechos posesorios veinteañal.
*Financiación propia
*Permutamos
*Recibimos vehículo
*Facilidad de pago"||||||||||True||||[]|
"Excelente Lote! Oportunidad en Parque Patricios CABA
Cant. Pisos PB + 5 + 2 Retiros (Total 7 Pisos) y 8 Cocheras en PB
Sup. Vendible viejo codigo: 343 M2 X FOT R2bI (1.60) = 548 M2
Sup. Vendible nuevo codigo: 1704 M2 X 80 % = 1363 M2
Nota: Ley N° 6323, La exencion de pago del derecho para el desarrollo urbano y el habitat sustentable (Plusvalia),
debe ser verificado por el interesado.
Nota: La incidencia del terreno es estimativa y debe ser verificada por el Interesado.
Nota: Dichos numeros son una aproximacion. Los calculos definitivos se definiran en base a un anteproyecto con consulta
Municipal, siendo verificados por el interesado.
AVISO LEGAL: Todas las fotos, imágenes y videos son meramente ilustrativos y no contractuales.
Las descripciones, medidas, superficies y proporciones consignadas en esta ficha son aproximadas, sólo se muestran a modo orientativo. La venta queda sujeta al cumplimiento por parte del propietario de lo establecido por la Resolución General Nº 2371 de AFIP (COTI)."|por la Resolución General Nº 2371|||1704 x 80||||||||||[]|
Inmobiliaria Perez Ferrero vende: LOTE en Villa Parque Siquiman n Las Tijeretas 655. superficie total: 608 mts2. poseen medidor con servicio de luz eléctrica y también medidor con servicio de agua corriente. Escrituras públicas de cesión de derechos posesorios veinteañal. Financiación propia. Permutamos. Recibimos vehículo. Facilidad de pago||||||||||True||||[]|
"ENTA- TERRENO 2036M2- EL MOLLAR. RE/MAX NOA II COMERCIALIZA VENTA EN B° EL MOLLAR. DESCRIPCIÓN: El terreno se encuentra en el Barrio El Mollar, cuenta con una superficie de 2036m² y cuenta con un amplio frente. La ubicación de la propiedad se encuentra a 5 cuadras de la Ruta Nacional N°2, a tan solo de 20 minutos de la Ciudad de San Salvador de Jujuy. En un excelente Barrio Privado.
CARACTERÍSTICAS: SUPERFICIE 2036m². SERVICIOS: AGUA, LUZ, CORDÓN CUNETA, Posesión inmediata. En cumplimiento de las leyes vigentes que regulan el corretaje inmobiliario, Ley Nacional 25.028, Ley 22.802 de Lealtad Comercial, Ley 24.240 de Defensa al Consumidor, las normas del Código Civil y Comercial de la Nación y Constitucionales, los agentes/gestores NO ejercen el corretaje inmobiliario. Todas las operaciones inmobiliarias son objeto de intermediación y conclusión por parte de los corredores públicos inmobiliarios."|a 5 cuadras de la Ruta Nacional N°2|||||Barrio El Mollar|||True|||True||[]|
"Hermoso lote en Chacras II-San Vicente. Lote en venta en el Barrio Fincas de San Vicente , Minichacra de 2400 m2.
Sector consolidado con  más 100 casas construidas y lotes de 2000 a 3600 mts. Compartiendo con Sporting Club y Fincas Laguna un sector común de espacio verde e infraestructura deportiva. Este increíble terreno ofrece una oportunidad única para aquellos que buscan un hogar en un entorno tranquilo y natural. Amplísimo  espacio para construir la casa de tus sueños. Ubicado en un barrio consolidado y de alta calidad en San Vicente, este lote promete ser el escenario perfecto para una vida apacible y en contacto con la naturaleza. 
Lote de 2400 mts cuadrados en Fincas de San Vicente, Chacras urbanas II FINCAS de San Vicente tiene un hermoso Club House, canchas de Voley, Tennis y Fútbol, SUM, área de recreación para niños. A pocos minutos del centro de San Vicente"||||||Barrio Fincas de San Vicente||||||||[]|True
